id,timestamp,text,actual_catg,display_text_range,retweet_count,favorite_count,img_num,p1,p1_conf,rate,rate_deno,name_1
716802964044845056,2016-04-04 01:41:58,This is Link. He struggles with couches. 10/10 would assist https://t.co/SbX4e6Yg3o,0,83,1311,4609,2,malinois,0.619577,10.0,10,Link
716791146589110272,2016-04-04 00:55:01,Meet Jennifur. She's supposed to be navigating. Not even buckled up. Insubordinate &amp; churlish. 11/10 would still pet https://t.co/h0trcJohYO,0,144,1473,5190,1,pomeranian,0.468751,11.0,10,Jennifur
716439118184652801,2016-04-03 01:36:11,This is Bluebert. He just saw that both #FinalFur match ups are split 50/50. Amazed af. 11/10 https://t.co/Kky1DPG4iq,0,117,246,2562,1,siberian_husky,0.396495,10.0,10,Bluebert
716285507865542656,2016-04-02 15:25:47,This is Stephanus. She stays woke. 12/10 https://t.co/WIWabMngQZ,0,64,1218,3025,1,yorkshire_terrier,0.43042,12.0,10,Stephanus
716080869887381504,2016-04-02 01:52:38,Here's a super majestic doggo and a sunset 11/10 https://t.co/UACnoyi8zu,doggo,72,1926,5252,1,golden_retriever,0.638625,11.0,10,0
715928423106027520,2016-04-01 15:46:52,This is Bubbles. He's a Yorkshire Piccolope. 11/10 would snug aggressively https://t.co/3BhMojONxq,0,98,985,3470,1,pug,0.976685,11.0,10,Bubbles
715733265223708672,2016-04-01 02:51:22,This is a taco. We only rate dogs. Please only send in dogs. Dogs are what we rate. Not tacos. Thank you... 10/10 https://t.co/cxl6xGY8B9,0,137,1908,5070,1,dandie_dinmont,0.740229,10.0,10,0
715696743237730304,2016-04-01 00:26:15,Meet Toby. He's a Lithuanian High-Steppin Stickeroo. One of the more accomplished Stickeroos around. 10/10 so nifty https://t.co/cYPHuJYTjC,0,139,1443,4237,1,staffordshire_bullterrier,0.427836,10.0,10,Toby
715680795826982913,2016-03-31 23:22:53,This is Zeus. He's downright fabulous. 12/10 https://t.co/sSugyyRuTp,0,68,1808,4699,1,golden_retriever,0.990715,12.0,10,Zeus
715360349751484417,2016-03-31 02:09:32,This is Bertson. He just wants to say hi. 11/10 would boop nose https://t.co/hwv7Wq6gDA,0,87,1764,5926,1,nail,0.8555520000000001,11.0,10,Bertson
715342466308784130,2016-03-31 00:58:29,This is Oscar. He's a world renowned snowball inspector. It's a ruff job but someone has to do it. 10/10 great guy https://t.co/vSufMAKm3C,0,138,766,3279,1,west_highland_white_terrier,0.597111,10.0,10,Oscar
715220193576927233,2016-03-30 16:52:36,This is Nico. His selfie game is strong af. Excellent use of a sneaky tongue slip. 10/10 star material https://t.co/1OBdJkMOFx,0,126,734,2613,1,chihuahua,0.584026,10.0,10,Nico
715200624753819648,2016-03-30 15:34:51,This is Michelangelope. He's half coffee cup. Rare af. 12/10 would hug until someone stopped me https://t.co/tvVDY0G911,0,119,2098,5565,1,chihuahua,0.956787,12.0,10,Michelangelope
715009755312439296,2016-03-30 02:56:24,This is Siba. She's remarkably mobile. Very sleepy as well. 12/10 would happily transport https://t.co/TjnI33RE1i,0,113,1391,4527,1,dingo,0.31090300000000004,12.0,10,Siba
714982300363173890,2016-03-30 01:07:18,This is Calbert. He forgot to clear his Google search history. 9/10 rookie mistake Calbert https://t.co/jRm5J3YCmj,0,114,1162,4076,1,brittany_spaniel,0.944376,9.0,10,Calbert
714957620017307648,2016-03-29 23:29:14,This is Curtis. He's an Albino Haberdasher. Terrified of dandelions. They really spook him up. 10/10 it'll be ok pup https://t.co/s8YcfZrWhK,0,140,1588,4487,1,great_pyrenees,0.251516,10.0,10,Curtis
714631576617938945,2016-03-29 01:53:39,This is Benedict. He's a feisty pup. Needs a brushing. Portable af. Looks very angry actually. 4/10 might not pet https://t.co/3oeFfHjv0Z,0,137,1115,3554,1,meerkat,0.143497,4.0,10,Benedict
714606013974974464,2016-03-29 00:12:05,Here are two lil cuddly puppers. Both 12/10 would snug like so much https://t.co/zO4eb7C4tG,pupper,91,1036,3924,1,norfolk_terrier,0.293007,12.0,10,0
714258258790387713,2016-03-28 01:10:13,"Meet Travis and Flurp. Travis is pretty chill but Flurp can't lie down properly. 10/10 &amp; 8/10
get it together Flurp https://t.co/Akzl5ynMmE",0,143,805,3265,1,collie,0.176758,10.0,10,0
714251586676113411,2016-03-28 00:43:43,This is Thumas. He hates potted plants. 8/10 wtf Thumas https://t.co/rDVueNIcEi,0,79,938,3552,2,soft-coated_wheaten_terrier,0.751962,8.0,10,Thumas
714214115368108032,2016-03-27 22:14:49,Happy Easter from the squad! ðŸ‡ðŸ¶ 13/10 for all https://t.co/YMx4KWJUAB,0,69,985,2471,1,pug,0.533967,13.0,10,0
714141408463036416,2016-03-27 17:25:54,"I know we only rate dogs, but since it's Easter I guess we could rate a bunny for a change. 10/10 petable as hell https://t.co/O2RlKXigHu",0,137,1560,4657,1,labrador_retriever,0.586951,10.0,10,0
713919462244790272,2016-03-27 02:43:58,This is Kanu. He's a Freckled Ticonderoga. Simply flawless. 12/10 would perform an elaborate heist to capture https://t.co/7vyAzIURrE,0,133,867,3545,1,siberian_husky,0.463223,12.0,10,Kanu
713900603437621249,2016-03-27 01:29:02,Happy Saturday here's 9 puppers on a bench. 99/90 good work everybody https://t.co/mpvaVxKmc1,pupper,93,827,3049,1,golden_retriever,0.371816,11.0,10,0
713761197720473600,2016-03-26 16:15:05,This is Piper. She would really like that tennis ball core. Super sneaky tongue slip. 12/10 precious af https://t.co/QP6GHi5az9,0,127,1536,5289,1,brittany_spaniel,0.797936,12.0,10,Piper
713411074226274305,2016-03-25 17:03:49,Here we see an extremely rare Bearded Floofmallow. Only a few left in the wild. 11/10 would pet with a purpose https://t.co/jVJJKlPbvq,0,134,1432,4778,1,great_pyrenees,0.720337,11.0,10,0
713177543487135744,2016-03-25 01:35:51,This is Lance. Lance doesn't give a shit. 10/10 we should all be more like Lance https://t.co/SqnG9Ap28J,0,104,3167,7817,1,whippet,0.734244,10.0,10,Lance
713175907180089344,2016-03-25 01:29:21,Say hello to Opie and Clarkus. Clarkus fell asleep so Opie buried him. Ruthless af 10/10 for both https://t.co/xT7XaY4gnW,0,121,1622,4831,1,timber_wolf,0.503788,10.0,10,0
712809025985978368,2016-03-24 01:11:29,This is Stubert. He just arrived. 10/10 https://t.co/HVGs5aAKAn,0,63,7555,20286,1,labrador_retriever,0.8686709999999999,10.0,10,Stubert
712717840512598017,2016-03-23 19:09:09,Please don't send in any more polar bears. We only rate dogs. Thank you... 10/10 https://t.co/83RGhdIQz2,0,104,5591,13412,1,great_pyrenees,0.732043,10.0,10,0
712668654853337088,2016-03-23 15:53:42,Say hello to Sunny and Roxy. They pull things out of water together. 10/10 for both https://t.co/88aedAmxcl,0,107,1363,4509,1,labrador_retriever,0.829058,10.0,10,0
712438159032893441,2016-03-23 00:37:48,This is Kane. He's a semi-submerged Haitian Huffleplop. Happy af. Sick waterfall. 11/10 would pat head approvingly https://t.co/7zjEC501Ul,0,138,1745,5773,1,ice_bear,0.869477,11.0,10,Kane
712097430750289920,2016-03-22 02:03:52,I can't even comprehend how confused this dog must be right now. 10/10 https://t.co/8AGcQ4hIfK,0,94,1165,4123,1,labrador_retriever,0.720481,10.0,10,0
712092745624633345,2016-03-22 01:45:15,This is Steven. He's inverted af. Also very helpful. Scans anything you want for free. Takes him a while tho. 7/10 https://t.co/tA0ZiQ7JcG,0,138,1011,3197,1,triceratops,0.235373,7.0,10,Steven
712085617388212225,2016-03-22 01:16:55,"Say hello to Olive and Ruby. They are best buddies. Both 11/10 
1 like = 1 buddy https://t.co/yagmFdKlyL",0,104,554,3515,2,shih-tzu,0.625129,11.0,10,0
712065007010385924,2016-03-21 23:55:01,This is Chester. He's clearly in charge of the other dogs. Weird ass paws. Not fit for fetch. 6/10 would still pet https://t.co/o2GvskrhHt,0,138,698,2443,1,goose,0.214301,6.0,10,Chester
711968124745228288,2016-03-21 17:30:03,Meet Winston. He's trapped in a cup of coffee. Poor pupper. 10/10 someone free him https://t.co/2e6cUtKUuc,pupper,106,2584,8738,1,espresso,0.4301350000000001,10.0,10,Winston
711743778164514816,2016-03-21 02:38:34,Meet Roosevelt. He's calculating the best case scenario if he drops out instead of doing math hw. 11/10 relatable af https://t.co/QcSIRDpfVg,0,140,1097,3086,1,lakeland_terrier,0.459515,11.0,10,Roosevelt
711732680602345472,2016-03-21 01:54:29,I want to hear the joke this dog was just told. 10/10 https://t.co/1KiuZqqOD4,0,77,4621,9713,3,dingo,0.366875,10.0,10,0
711694788429553666,2016-03-20 23:23:54,Oh. My. God. 13/10 magical af https://t.co/Ezu6jQrKAZ,0,53,20400,35709,1,brown_bear,0.7132930000000001,13.0,10,0
711652651650457602,2016-03-20 20:36:28,This is Gary. He just wanted to say hi. 9/10 very personable pup https://t.co/Sk3CbhmKSW,0,88,1032,4208,1,llama,0.8567889999999999,9.0,10,Gary
711363825979756544,2016-03-20 01:28:47,"""Please, no puparazzi"" 11/10 https://t.co/nJIXSPfedK",0,52,1281,3981,1,pembroke,0.7509060000000001,11.0,10,0
711306686208872448,2016-03-19 21:41:44,What hooligan sent in pictures w/out a dog in them? Churlish af. 3/10 just bc that's a neat fluffy bean bag chair https://t.co/wcwoGOkZvz,0,137,812,3584,1,leatherback_turtle,0.280835,3.0,10,0
711008018775851008,2016-03-19 01:54:56,This is Chuckles. He had a balloon but he accidentally let go of it and it floated away. 11/10 hang in there pupper https://t.co/68iNM7B5gW,pupper,139,703,3255,1,french_bulldog,0.731405,11.0,10,Chuckles
710997087345876993,2016-03-19 01:11:29,Meet Milo and Amos. They are the best of pals. Both 12/10 would pet at the same time https://t.co/Mv37BHEyyD,0,108,1554,4943,1,malamute,0.28126,12.0,10,0
710844581445812225,2016-03-18 15:05:29,This is Staniel. His selfie game is strong af. 10/10 I'd snapchat with Staniel https://t.co/UgkTw7TKyM,0,102,775,2765,1,dingo,0.536593,10.0,10,Staniel
710833117892898816,2016-03-18 14:19:56,Say hello to Sora. She's an Egyptian Pumpernickel. Mesmerizing af. 12/10 would bring home to mom https://t.co/PmTR4kxZkq,0,120,603,2928,1,pembroke,0.803742,12.0,10,Sora
710658690886586372,2016-03-18 02:46:49,Here's a brigade of puppers. All look very prepared for whatever happens next. 80/80 https://t.co/0eb7R1Om12,pupper,108,633,2513,1,soft-coated_wheaten_terrier,0.948617,10.0,10,0
710588934686908417,2016-03-17 22:09:38,This is Beemo. He's a Chubberflop mix. 12/10 would cross the world for https://t.co/kzMVMU8HBV,0,94,2099,4947,4,pembroke,0.982004,12.0,10,Beemo
710283270106132480,2016-03-17 01:55:02,This is Gunner. He's a Figamus Newton. King of the peek-a-boo. Cool jeans. 11/10 https://t.co/ONuBILIYXZ,0,104,578,2298,2,shih-tzu,0.932401,11.0,10,Gunner
710272297844797440,2016-03-17 01:11:26,We ðŸ‘ðŸ» only ðŸ‘ðŸ» rate ðŸ‘ðŸ» dogs. Pls stop sending in non-canines like this Dutch Panda Worm. This is infuriating. 11/10 https://t.co/odfLzBonG2,0,138,1414,4911,1,old_english_sheepdog,0.586307,11.0,10,infuriating
710269109699739648,2016-03-17 00:58:46,"The squad is back for St. Patrick's Day! â˜˜ ðŸ’š
13/10 for all https://t.co/OcCDb2bng5",0,82,1255,2597,1,pug,0.415495,13.0,10,0
710153181850935296,2016-03-16 17:18:07,This is Lacy. She's tipping her hat to you. Daydreams of her life back on the frontier. 11/10 would pet so well https://t.co/fG5Pk3Et1I,0,135,1001,3141,2,cowboy_hat,0.979053,11.0,10,Lacy
710140971284037632,2016-03-16 16:29:35,This is Tater. His underbite is fierce af. Doesn't give a damn about your engagement photo. 8/10 https://t.co/nLuPY3pY12,0,120,1000,2999,1,pekinese,0.95317,8.0,10,Tater
710117014656950272,2016-03-16 14:54:24,This pupper got her hair chalked for her birthday. Hasn't told her parents yet. Rebellious af. 11/10 very nifty https://t.co/h1OX2mLtxV,pupper,135,2224,5975,2,toy_poodle,0.802092,11.0,10,0
709918798883774466,2016-03-16 01:46:45,Meet Watson. He's a Suzuki Tickleboop. Leader of a notorious biker gang. Only one ear functional. 12/10 snuggable af https://t.co/R1gLc5vDqG,0,140,1207,3235,2,pembroke,0.956222,12.0,10,Watson
709901256215666688,2016-03-16 00:37:03,"WeRateDogs stickers are here and they're 12/10! Use code ""puppers"" at checkout ðŸ¶ðŸ¾

Shop now: https://t.co/k5xsufRKYm https://t.co/ShXk46V13r",pupper,140,112,730,2,bib,0.998814,12.0,10,0
709852847387627521,2016-03-15 21:24:41,*lets out a tiny whimper and then collapses* ...12/10 https://t.co/BNdVZEHRow,0,77,1331,3803,2,chihuahua,0.945629,12.0,10,0
709566166965075968,2016-03-15 02:25:31,This is Olaf. He's gotta be rare. Seems sturdy. Tail is floofy af. 12/10 would do whatever it takes to pet https://t.co/E9jaU59bh9,0,130,1363,3846,1,chow,0.999837,12.0,10,Olaf
709556954897764353,2016-03-15 01:48:55,This is Cecil. She's a Gigglefloof Poofer. Outdoorsy af. One with nature. 12/10 would strategically capture https://t.co/ijJB0DuOIC,0,131,1196,3575,2,golden_retriever,0.790026,12.0,10,Cecil
709519240576036864,2016-03-14 23:19:03,This is Vince. He's a Gregorian Flapjeck. White spot on legs almost looks like another dog (whoa). 9/10 rad as hell https://t.co/aczGAV2dK4,0,139,276,1612,1,cocker_spaniel,0.414982,9.0,10,Vince
709449600415961088,2016-03-14 18:42:20,Meet Karma. She's just a head. Lost body during the Second Punic War (unfortunate). Loves to travel 10/10 petable af https://t.co/c6af6nYEPo,0,140,663,2417,2,maltese_dog,0.780187,10.0,10,Karma
709409458133323776,2016-03-14 16:02:49,This is Billy. He sensed a squirrel. 8/10 damn it Billy https://t.co/Yu0K98VZ9A,0,79,782,2836,1,shetland_sheepdog,0.79745,8.0,10,Billy
709225125749587968,2016-03-14 03:50:21,This is Walker. He's a Butternut Khalifa. Appears fuzzy af. 11/10 would hug for a ridiculous amount of time https://t.co/k6fEWHSALn,0,131,643,2604,1,labrador_retriever,0.271109,11.0,10,Walker
709207347839836162,2016-03-14 02:39:42,This is Penny. She's trying on her prom dress. Stunning af 11/10 https://t.co/qcZDZGCapg,0,88,6529,13684,1,chihuahua,0.948323,11.0,10,Penny
709198395643068416,2016-03-14 02:04:08,"From left to right:
Cletus, Jerome, Alejandro, Burp, &amp; Titson
None know where camera is. 45/50 would hug all at once https://t.co/sedre1ivTK",0,144,716,2623,1,borzoi,0.490783,9.0,10,0
709158332880297985,2016-03-13 23:24:56,Meet Rodney. He's a Ukranian Boomchicka. Outside but would like to be inside. Only has one ear (unfortunate) 10/10 https://t.co/FjAj3ggXrR,0,138,469,2224,1,siberian_husky,0.212957,10.0,10,Rodney
709042156699303936,2016-03-13 15:43:18,This is Klevin. He's addicted to sandwiches (yes a hotdog is a sandwich fight me) It's tearing his family apart 9/10 https://t.co/7BkkVNu5pd,0,140,1853,5174,1,hotdog,0.8265790000000001,9.0,10,Klevin
708845821941387268,2016-03-13 02:43:08,Here's a pupper with magic eyes. Not wearing a seat belt tho (irresponsible af). Very distracting to driver. 9/10 https://t.co/5DLJB4ssvI,pupper,137,1008,3217,1,schipperke,0.74564,9.0,10,0
708834316713893888,2016-03-13 01:57:25,Meet Malikai. He was rolling around having fun when he remembered the inevitable heat death of the universe. 10/10 https://t.co/Vd2FqHIIGn,0,138,568,1848,1,eskimo_dog,0.283945,10.0,10,Malikai
708810915978854401,2016-03-13 00:24:26,This is Mister. He's a wonderful father to his two pups. Heartwarming af. 10/10 for all https://t.co/2KcuJXL2r4,0,111,7800,17967,2,golden_retriever,0.976139,10.0,10,Mister
708738143638450176,2016-03-12 19:35:15,This is Coco. She gets to stay on the Bachelor for another week. Super pumped 11/10 https://t.co/wsCB6LFNxD,0,107,914,2984,1,pomeranian,0.933457,11.0,10,Coco
708711088997666817,2016-03-12 17:47:45,This is Smokey. He really likes tennis balls. 11/10 https://t.co/Ah7WlYTUBQ,0,75,829,2771,2,tennis_ball,0.912961,11.0,10,Smokey
708479650088034305,2016-03-12 02:28:06,Meet Bear. He's a Beneboop Cumberclap. Extremely unamused. 13/10 I'm in love with this picture https://t.co/uC8kUqAz0W,0,118,760,2756,1,shih-tzu,0.218479,13.0,10,Bear
708469915515297792,2016-03-12 01:49:25,This is Bobble. He's a Croatian Galifianakis. Hears everything within 400 miles. 11/10 would snug diligently https://t.co/VwDc6PTDzk,0,132,921,3343,1,chihuahua,0.748163,11.0,10,Bobble
708356463048204288,2016-03-11 18:18:36,This is Oliver. That is his castle. He protects it with his life. He's also squishy af. 10/10 would squish softly https://t.co/oSuEGw0BhX,0,137,1511,3907,2,pug,0.871283,10.0,10,Oliver
708349470027751425,2016-03-11 17:50:48,This is River. He's changing the trumpet game. Innovative af. 11/10 such a good boy https://t.co/tK7a0AxQfd,0,107,829,2552,1,muzzle,0.24389,11.0,10,River
708149363256774660,2016-03-11 04:35:39,This is Jebberson. He's the reigning hide and seek world champion. 10/10 hasn't lost his touch https://t.co/VEFkvWCoHF,0,118,1722,4639,1,cardigan,0.350993,10.0,10,Jebberson
708130923141795840,2016-03-11 03:22:23,Please stop sending in non canines like this Guatemalan Twiggle Bunny. We only rate dogs. Only send in dogs... 11/10 https://t.co/XKhobeGuvT,0,140,935,3682,1,french_bulldog,0.710354,11.0,10,0
708119489313951744,2016-03-11 02:36:57,This is Cooper. He basks in the glory of rebellion. 9/10 probably a preteen https://t.co/kDamUfeIpm,0,99,1101,2924,1,norwich_terrier,0.264483,9.0,10,Cooper
708109389455101952,2016-03-11 01:56:49,This is Remington. He was caught off guard by the magical floating cheese. Spooked af. 10/10 deep breaths pup https://t.co/mhPSADiJmZ,0,133,606,2109,1,staffordshire_bullterrier,0.5161060000000001,10.0,10,Remington
708026248782585858,2016-03-10 20:26:26,Everybody stop what you're doing and watch this video. Frank is stuck in a loop. 13/10 (Vid by @klbmatty) https://t.co/5AJs8TIV1U,0,129,2158,4772,1,malinois,0.7864680000000001,13.0,10,0
707995814724026368,2016-03-10 18:25:30,This is Farfle. He lost his back legs during the Battle of Gettysburg. Goes 0-60 in 4.3 seconds (damn) 12/10 hero af https://t.co/NiQQWzIzzq,0,140,1268,3372,1,agama,0.172087,12.0,10,Farfle
707969809498152960,2016-03-10 16:42:10,Meet Rufus. He's a Honeysuckle Firefox. Curly af. Badass tie. About to go on his first date ever 11/10 good luck pup https://t.co/dGoTWNfIsm,0,140,1090,2932,1,toy_poodle,0.908491,11.0,10,Rufus
707776935007539200,2016-03-10 03:55:45,This is Sadie. She's a Bohemian Rhapsody. Remarkably portable. Could sneak on roller coasters with (probably). 11/10 https://t.co/DB8fyeDs8B,0,140,1072,3570,1,miniature_pinscher,0.890426,11.0,10,Sadie
707741517457260545,2016-03-10 01:35:01,When your roommate eats your leftover Chili's but you pretend it's no big deal cuz you fat anyway. 10/10 head up pup https://t.co/0nMgoue8IR,0,140,691,2706,1,whippet,0.738371,10.0,10,0
707693576495472641,2016-03-09 22:24:31,This is Jiminus. He's in a tub for some reason. What a jokester. Smh 7/10 churlish af https://t.co/84L4ED9Tpi,0,109,1121,3739,1,bathtub,0.499525,7.0,10,Jiminus
707610948723478529,2016-03-09 16:56:11,This is Harper. She scraped her elbow attempting a backflip off a tree. Valiant effort tho. 12/10 https://t.co/oHKJHghrp5,0,121,7196,18484,1,golden_retriever,0.383223,12.0,10,Harper
707420581654872064,2016-03-09 04:19:44,This is Keurig. He's a rare dog. Laughs like an idiot tho. Head is basically a weapon. Poorly maintained goatee 4/10 https://t.co/xOrUyj7K30,0,140,785,2487,1,ram,0.518215,4.0,10,Keurig
707411934438625280,2016-03-09 03:45:22,"""I shall trip the big pupper with leash. Big pupper will never see it coming. I am a genius."" Both 11/10 https://t.co/uQsCJ8pf51",pupper,128,670,2475,1,lakeland_terrier,0.7382770000000001,11.0,10,0
707387676719185920,2016-03-09 02:08:59,Meet Clarkus. He's a Skinny Eastern Worcestershire. Can tie own shoes (impressive af) 10/10 would put on track team https://t.co/XP5o7zGn0E,0,139,1478,3823,1,chihuahua,0.888468,10.0,10,Clarkus
707377100785885184,2016-03-09 01:26:57,This dog just brutally murdered a snowman. Currently toying with its nutritious remains 9/10 would totally still pet https://t.co/iKThgKnW1j,0,140,1208,3585,1,golden_retriever,0.637225,9.0,10,0
707315916783140866,2016-03-08 21:23:50,This is Finnegus. He's trapped in a snow globe. Poor pupper. 10/10 would make sure no one shook it https://t.co/BjpOa52jQ4,pupper,122,725,2691,2,bernese_mountain_dog,0.979235,10.0,10,Finnegus
707297311098011648,2016-03-08 20:09:54,This is Cassie. She can go from sweet to scary af in a matter of seconds. 10/10 points deducted for cats on pajamas https://t.co/B6dmZmJBdK,0,139,901,3008,1,blenheim_spaniel,0.370717,10.0,10,Cassie
707059547140169728,2016-03-08 04:25:07,Say hello to Cupcake. She's an Icelandic Dippen Dot. Confused by the oddly geometric lawn pattern. 11/10 https://t.co/D7rorf4YKL,0,128,754,2790,1,samoyed,0.8973120000000001,11.0,10,Cupcake
707038192327901184,2016-03-08 03:00:15,This is Kathmandu. He sees every move you make. Probably knows Jiu-Jitsu. 10/10 mysterious af https://t.co/z0cs7E4Xjj,0,117,897,2391,1,pug,0.642426,10.0,10,Kathmandu
707021089608753152,2016-03-08 01:52:18,This is Tucker. He's a Dasani Episcopalian. Good lord what a tongue. 12/10 would never let go of https://t.co/gHtW5cgyy7,0,120,1535,4424,2,cocker_spaniel,0.559658,12.0,10,Tucker
707014260413456384,2016-03-08 01:25:10,This is Ellie. She requests to be carried around in a lacrosse stick at all times. 11/10 impossible to say no https://t.co/15yCmd43zU,0,133,659,2496,1,chihuahua,0.58378,11.0,10,Ellie
706901761596989440,2016-03-07 17:58:08,This is Elliot. He's blocking the roadway. Downright rude as hell. Doesn't care that you're already late. 3/10 https://t.co/FMUxir5pYu,0,134,676,2255,1,wild_boar,0.859499,3.0,10,Elliot
706681918348251136,2016-03-07 03:24:33,Say hello to Katie. She's a Mitsubishi Hufflepuff. Curly af. 12/10 I'd do terrible things to acquire such a pup https://t.co/CFPIcGcwJv,0,135,1091,3608,1,toy_poodle,0.717584,12.0,10,Katie
706644897839910912,2016-03-07 00:57:27,Meet Shadow. She's tired of the responsibilities associated with being a dog. No longer strives to attain ball. 9/10 https://t.co/cdOkfEpjFw,0,140,1220,2804,1,space_heater,0.137871,9.0,10,Shadow
706593038911545345,2016-03-06 21:31:22,Here's a sneak peek of me on spring break. 10/10 so many tired pups these days https://t.co/6aJrjKfNqX,0,102,716,2350,1,four-poster,0.6964229999999999,10.0,10,0
706538006853918722,2016-03-06 17:52:42,"This is Oliver (pronounced ""Ricardo""). He's a ship captain. Controls these treacherous waters. 11/10 would sail with https://t.co/bxjO45rXKd",0,140,1574,3757,1,chow,0.541794,11.0,10,0
706516534877929472,2016-03-06 16:27:23,Please enjoy this pup in a cooler. Permanently ready for someone to throw a tennis ball his way. 12/10 https://t.co/KUS0xl7XIp,0,126,1147,3388,1,golden_retriever,0.7726850000000001,12.0,10,0
706346369204748288,2016-03-06 05:11:12,This is Koda. She's a Beneboom Cumberwiggle. 12/10 petable as hell https://t.co/VZV6oMJmU6,0,90,1030,3755,1,tibetan_mastiff,0.956462,12.0,10,Koda
706310011488698368,2016-03-06 02:46:44,Here's a very sleepy pupper. Thinks it's an airplane. 12/10 would snug for eternity https://t.co/GGmcTIkBbf,pupper,107,8987,23355,1,pembroke,0.6981649999999999,12.0,10,0
706291001778950144,2016-03-06 01:31:11,When you're just relaxin and having a swell time but then remember you have to fill out the FAFSA ...11/10 https://t.co/qy33OBcexg,0,130,521,1850,1,border_terrier,0.587101,11.0,10,0
706265994973601792,2016-03-05 23:51:49,"This is Kara. She's been trying to solve that thing for 3 days. ""I don't have thumbs,"" she said. 11/10 solid effort https://t.co/lA6a8GefrV",0,139,1027,2964,1,papillon,0.743715,11.0,10,Kara
706166467411222528,2016-03-05 17:16:20,This is Dexter. He's a shy pup. Doesn't bark much. Dreadful fetcher. Has rare sun allergy. 7/10 still petable https://t.co/sA7P3JSqiv,0,133,1811,5605,1,samoyed,0.430418,7.0,10,Dexter
705975130514706432,2016-03-05 04:36:02,This is Adele. Her tongue flies out of her mouth at random. It's a debilitating illness. 10/10 stay strong pupper https://t.co/cfn81n3FLO,pupper,137,838,3386,1,staffordshire_bullterrier,0.5877640000000001,10.0,10,Adele
705970349788291072,2016-03-05 04:17:02,This is Lucy. She's a Venetian Kerploof. Supposed to be navigating. Quite irresponsible. Fancy ass collar tho 12/10 https://t.co/8tjnz1L8DI,0,139,1005,3424,1,golden_retriever,0.776346,12.0,10,Lucy
705898680587526145,2016-03-04 23:32:15,Meet Max. He's a Fallopian Cephalopuff. Eyes are magical af. Lil dandruff problem. No big deal 10/10 would still pet https://t.co/c67nUjwmFs,0,140,640,2582,1,collie,0.808276,10.0,10,Max
705786532653883392,2016-03-04 16:06:36,"Seriously, add us ðŸ¶ 11/10 for sad wet pupper https://t.co/xwPE9faVZR",pupper,68,592,2125,1,web_site,0.550294,11.0,10,0
705591895322394625,2016-03-04 03:13:11,"""Ma'am, for the last time, I'm not authorized to make that type of transaction"" 11/10 https://t.co/nPTBsdm3BF",0,109,1301,3453,1,basenji,0.877207,11.0,10,0
705475953783398401,2016-03-03 19:32:29,Say hello to Zara. She found a sandal and couldn't be happier. 12/10 great work https://t.co/zQUuVu812n,0,103,1042,3220,1,golden_retriever,0.908784,12.0,10,Zara
705442520700944385,2016-03-03 17:19:38,This is Cooper. He only wakes up to switch gears. 12/10 helpful af https://t.co/EEIkAGVY64,0,90,1850,4860,1,great_pyrenees,0.309106,12.0,10,Cooper
705428427625635840,2016-03-03 16:23:38,This is Ambrose. He's an Alfalfa Ballyhoo. Draws pistol fast af. Pretty much runs the frontier. 11/10 lethal pupper https://t.co/ih6epBOxIA,pupper,139,1924,4173,1,chihuahua,0.774792,11.0,10,Ambrose
705239209544720384,2016-03-03 03:51:44,This is Jimothy. He lost his body during the the Third Crusade (tragic). 11/10 heroic af tho https://t.co/wnsblfu7XE,0,116,848,3271,1,chihuahua,0.15795,11.0,10,Jimothy
705223444686888960,2016-03-03 02:49:06,This is Bode. He's a heavy sleeper. 9/10 https://t.co/YMkxhGWUqv,0,64,898,2816,1,egyptian_cat,0.0905082,9.0,10,Bode
705102439679201280,2016-03-02 18:48:16,This is Terrenth. He just stubbed his toe. 10/10 deep breaths Terrenth https://t.co/Pg18CDFC7Z,0,94,580,2339,1,collie,0.457672,10.0,10,Terrenth
705066031337840642,2016-03-02 16:23:36,This is Reese. He's a Chilean Sohcahtoa. Loves to swing. Never sure what to do with his feet. 12/10 huggable af https://t.co/VA6jnNUyuW,0,135,680,2363,1,airedale,0.868658,12.0,10,Reese
704871453724954624,2016-03-02 03:30:25,I found a forest Pipsy. 12/10 https://t.co/mIQ1KoVsmU,0,53,1244,4564,1,norfolk_terrier,0.689504,12.0,10,0
