id,timestamp,text,actual_catg,display_text_range,retweet_count,favorite_count,img_num,p1,p1_conf,rate,rate_deno,name_1
678969228704284672,2015-12-21 16:04:13,Meet Lola. She's a Metamorphic Chartreuse. Plays with her food. Insubordinate and churlish. Exquisite hardwood 11/10 https://t.co/etpBNXwN7f,0,140,527,1788,1,labrador_retriever,0.680251,11.0,10,Lola
678800283649069056,2015-12-21 04:52:53,Here's a pupper with some mean tan lines. Snazzy sweater though 12/10 https://t.co/DpCSVsl6vu,pupper,93,1014,2800,1,labrador_retriever,0.213673,12.0,10,0
678798276842360832,2015-12-21 04:44:55,This is Linda. She fucking hates trees. 7/10 https://t.co/blaY85FIxR,0,68,1344,3790,1,airedale,0.583122,7.0,10,Linda
678774928607469569,2015-12-21 03:12:08,This is Tug. He's not required to wear the cone he just wants his voice to project more clearly. 11/10 https://t.co/Sp739Ou2qx,0,126,1038,3025,1,pembroke,0.194681,11.0,10,Tug
678767140346941444,2015-12-21 02:41:11,This is Mia. She makes awful decisions. 8/10 https://t.co/G6TQVgTcZz,0,68,1544,3846,1,harp,0.8211200000000001,8.0,10,Mia
678764513869611008,2015-12-21 02:30:45,"Meet Wilson. He got caught humping the futon. He's like ""dude, help me out here"" 10/10 I'd help Wilson out https://t.co/m6XoclB0qv",0,130,542,1776,1,irish_terrier,0.696646,10.0,10,Wilson
678755239630127104,2015-12-21 01:53:54,This is Dash. He didn't think the water would be that cold. Damn it Dash it's December. Think a little. 10/10 https://t.co/NqcOwG8pxW,0,133,3724,7779,1,malamute,0.606654,10.0,10,Dash
678740035362037760,2015-12-21 00:53:29,Meet Tango. He's a large dog. Doesn't care much for personal space. Owner isn't very accepting. Tongue slip. 6/10 https://t.co/p2T5kGebxe,0,137,1920,4086,1,seat_belt,0.7871640000000001,6.0,10,Tango
678675843183484930,2015-12-20 20:38:24,Exotic pup here. Tail long af. Throat looks swollen. Might breathe fire. Exceptionally unfluffy 2/10 would still pet https://t.co/a8SqCaSo2r,0,140,1674,3136,1,maze,0.33985,2.0,10,0
678643457146150913,2015-12-20 18:29:43,Meet Grizz. He just arrived. Couldn't wait until Christmas. Worried bc he saw the swastikas on the carpet. 10/10 https://t.co/QBGwYrT7rv,0,136,486,2239,1,labrador_retriever,0.33875700000000003,10.0,10,Grizz
678446151570427904,2015-12-20 05:25:42,Touching scene here. Really stirs up the emotions. The bond between father &amp; son. So beautiful. 10/10 for both pups https://t.co/AJWJHov5gx,0,143,1777,4340,1,staffordshire_bullterrier,0.284492,10.0,10,0
678424312106393600,2015-12-20 03:58:55,This is Crystal. She's a shitty fireman. No sense of urgency. People could be dying Crystal. 2/10 just irresponsible https://t.co/rtMtjSl9pz,0,140,2866,5887,1,maltese_dog,0.759945,2.0,10,Crystal
678410210315247616,2015-12-20 03:02:53,Say hello to Jerome. He can shoot french fries out of his mouth at insane speeds. Deadly af. 10/10 https://t.co/dIy88HwrX8,0,122,2060,4616,1,schipperke,0.145877,10.0,10,Jerome
678399652199309312,2015-12-20 02:20:55,This made my day. 12/10 please enjoy https://t.co/VRTbo3aAcm,0,60,30797,62146,1,swing,0.929196,12.0,10,0
678396796259975168,2015-12-20 02:09:34,These little fellas have opposite facial expressions. Both 12/10 https://t.co/LmThv0GWen,0,88,472,1722,2,pembroke,0.95618,12.0,10,0
678389028614488064,2015-12-20 01:38:42,"This is Bella. She just learned that her final grade in chem was a 92.49 
poor pupper 11/10 https://t.co/auOoKuoveM",pupper,115,469,2035,1,miniature_pinscher,0.516284,11.0,10,Bella
678380236862578688,2015-12-20 01:03:46,This is Crumpet. He underestimated the snow. Quickly retreating. 10/10 https://t.co/a0Zx5LDFZa,0,94,1017,2641,1,dogsled,0.08854,10.0,10,Crumpet
678341075375947776,2015-12-19 22:28:09,This pupper likes tape. 12/10 https://t.co/cSp6w5GWgm,pupper,53,610,1886,1,golden_retriever,0.853284,12.0,10,0
678334497360859136,2015-12-19 22:02:01,This is Rosie. She has a snazzy bow tie and a fin for a tail. Probably super fast underwater. Cool socks 10/10 https://t.co/GO76MdGBs0,0,134,302,1423,1,norfolk_terrier,0.378643,10.0,10,Rosie
678278586130948096,2015-12-19 18:19:51,Another spooky pupper here. Most definitely floating. No legs. Probably knows some dark magic. 10/10 very spooked https://t.co/JK8MByRzgj,pupper,137,6810,12477,1,maltese_dog,0.897841,10.0,10,0
678255464182861824,2015-12-19 16:47:58,This is Jessifer. She is a Bismoth Teriyaki. Flowers being attacked by hurricanes on bandana (rad). 9/10 stellar pup https://t.co/nZhmRwZzWv,0,140,417,1719,1,chihuahua,0.613819,9.0,10,Jessifer
678021115718029313,2015-12-19 01:16:45,This is Reese. He likes holding hands. 12/10 https://t.co/cbLroGCbmh,0,68,7114,14950,1,miniature_pinscher,0.822048,12.0,10,Reese
677918531514703872,2015-12-18 18:29:07,"""Everything looks pretty good in there. Make sure to brush your gums. Been flossing? How's school going?"" Both 10/10 https://t.co/lWL2IMJqLR",0,140,461,1470,1,eskimo_dog,0.199347,10.0,10,0
677895101218201600,2015-12-18 16:56:01,Guys this was terrifying. Really spooked me up. We don't rate ghosts. We rate dogs. Please only send dogs... 9/10 https://t.co/EJImi1udYb,0,137,2371,5256,1,dalmatian,0.550702,9.0,10,0
677716515794329600,2015-12-18 05:06:23,IT'S PUPPERGEDDON. Total of 144/120 ...I think https://t.co/ZanVtAtvIq,pupper,70,1101,3310,1,teddy,0.6629079999999999,12.0,10,0
677700003327029250,2015-12-18 04:00:46,This is Ralph. He's an interpretive dancer. 10/10 https://t.co/zoDdPyPFsa,0,73,1613,3675,1,siberian_husky,0.120849,10.0,10,Ralph
677698403548192770,2015-12-18 03:54:25,This is Sadie. She got her holidays confused. 9/10 damn it Sadie https://t.co/fm7HxOsuPK,0,88,361,1325,1,shih-tzu,0.916645,9.0,10,Sadie
677687604918272002,2015-12-18 03:11:30,This was Cindy's face when she heard Susan forgot the snacks for after the kid's soccer game. 11/10 https://t.co/gzkuVGRgAD,0,123,948,2670,1,pembroke,0.573047,11.0,10,0
677673981332312066,2015-12-18 02:17:22,Endangered triangular pup here. Could be a wizard. Caught mid-laugh. No legs. Just fluff. Probably a wizard. 9/10 https://t.co/GFVIHIod0Z,0,137,1669,3596,1,maltese_dog,0.817908,9.0,10,0
677662372920729601,2015-12-18 01:31:14,"In honor of the new Star Wars movie. Here's Yoda pug. 12/10 pet really well, would I https://t.co/pvjdRn00XH",0,108,1097,2123,1,cowboy_hat,0.25611,12.0,10,0
677644091929329666,2015-12-18 00:18:36,This is a dog swinging. I really enjoyed it so I hope you all do as well. 11/10 https://t.co/Ozo9KHTRND,0,103,885,2031,1,chihuahua,0.626236,11.0,10,0
677573743309385728,2015-12-17 19:39:03,This is Sandy. He's sexually confused. Thinks he's a pigeon. Also an All-American cheese catcher. 10/10 so petable https://t.co/Htu8plSqEu,0,138,816,2312,2,patio,0.5350699999999999,10.0,10,Sandy
677565715327688705,2015-12-17 19:07:09,Contortionist pup here. Inside pentagram. Clearly worships Satan. Known to slowly push fragile stuff off tables 6/10 https://t.co/EX9oR55VMe,0,140,512,1403,1,basset,0.397295,6.0,10,0
677557565589463040,2015-12-17 18:34:46,Reckless pupper here. Not even looking at road. Absolute menace. No regard for fellow pupper lives. 10/10 still cute https://t.co/96IBkOYB7j,pupper,140,1314,2653,1,seat_belt,0.27725700000000003,10.0,10,0
677547928504967168,2015-12-17 17:56:29,Not much to say here. I just think everyone needs to see this. 12/10 https://t.co/AGag0hFHpe,0,92,4057,7535,1,american_staffordshire_terrier,0.914978,12.0,10,0
677530072887205888,2015-12-17 16:45:31,Say hello to Axel. He's a Black Chevy Pinot on wheels. 0 to 60 in 5.7 seconds (if downhill). 9/10 I call shotgun https://t.co/DKe9DBnnHE,0,136,249,1156,1,staffordshire_bullterrier,0.6892590000000001,9.0,10,Axel
677334615166730240,2015-12-17 03:48:51,This dog gave up mid jump. 9/10 https://t.co/KmMv3Y2zI8,0,55,327,1470,2,lakeland_terrier,0.859392,9.0,10,0
677331501395156992,2015-12-17 03:36:28,Meet Humphrey. He's a Northern Polyp Viagra. One ear works. Face stuck like that. Always surprised. 9/10 petable af https://t.co/FS7eJQM2F4,0,139,264,1179,1,beagle,0.313464,9.0,10,Humphrey
677328882937298944,2015-12-17 03:26:04,This is Derek. All the dogs adore Derek. He's a great guy. 10/10 really solid pup https://t.co/KgcsGNb61s,0,105,1681,3925,1,water_buffalo,0.42425,10.0,10,Derek
677314812125323265,2015-12-17 02:30:09,"Meet Tassy &amp; Bee. Tassy is pretty chill, but Bee is convinced the Ruffles are haunted. 10/10 &amp; 11/10 respectively https://t.co/fgORpmTN9C",0,145,609,1783,2,blenheim_spaniel,0.924127,10.0,10,0
677301033169788928,2015-12-17 01:35:24,This is Juckson. He's totally on his way to a nascar race. 5/10 for Juckson https://t.co/IoLRvF0Kak,0,99,468,1355,1,japanese_spaniel,0.6611779999999999,5.0,10,Juckson
677269281705472000,2015-12-16 23:29:14,This is the happiest pupper I've ever seen. 10/10 would trade lives with https://t.co/ep8ATEJwRb,pupper,96,788,2144,1,shetland_sheepdog,0.656616,10.0,10,0
677228873407442944,2015-12-16 20:48:40,Say hello to Chuq. He just wants to fit in. 11/10 https://t.co/hGkMCjZzn4,0,73,1829,3826,1,common_iguana,0.566338,11.0,10,Chuq
677187300187611136,2015-12-16 18:03:28,Here we see a Byzantine Rigatoni. Very aerodynamic. No eyes. Actually not windy here they just look like that. 9/10 https://t.co/gzI0m6wXRo,0,139,1031,2964,1,english_setter,0.282396,9.0,10,0
676975532580409345,2015-12-16 04:01:59,This is Cooper. He doesn't know how cheese works. Likes the way it feels on his face. Cheeky tongue slip. 11/10 https://t.co/j1zczS0lI5,0,135,1196,3000,1,malamute,0.363257,11.0,10,Cooper
676957860086095872,2015-12-16 02:51:45,10/10 I'd follow this dog into battle no questions asked https://t.co/ngTNXYQF0L,0,80,902,2381,1,labrador_retriever,0.772423,10.0,10,0
676949632774234114,2015-12-16 02:19:04,This is Tyrus. He's a Speckled Centennial Ticonderoga. Terrified of floating red ball. Nifty bandana. 8/10 v petable https://t.co/HqM3YhCaaa,0,140,444,1407,1,welsh_springer_spaniel,0.206479,8.0,10,Tyrus
676948236477857792,2015-12-16 02:13:31,This is Karl. Karl thinks he's slick. 6/10 sneaky pup https://t.co/Lo4ALwjVh4,0,77,977,2341,1,guenon,0.611603,6.0,10,Karl
676946864479084545,2015-12-16 02:08:04,This pups goal was to get all four feet as close to each other as possible. Valiant effort 12/10 https://t.co/2mXALbgBTV,0,120,424,1829,1,pekinese,0.752707,12.0,10,0
676942428000112642,2015-12-16 01:50:26,Who leaves the last cupcake just sitting there? 9/10 https://t.co/PWMqAoEx2a,0,76,852,2247,1,black-footed_ferret,0.707199,9.0,10,0
676936541936185344,2015-12-16 01:27:03,Here we see a rare pouched pupper. Ample storage space. Looks alert. Jumps at random. Kicked open that door. 8/10 https://t.co/mqvaxleHRz,pupper,137,5486,13731,1,chesapeake_bay_retriever,0.5452859999999999,8.0,10,0
676897532954456065,2015-12-15 22:52:02,Exotic handheld dog here. Appears unathletic. Feet look deadly. Can be thrown a great distance. 5/10 might pet idk https://t.co/Avq4awulqk,0,138,813,2419,1,hamster,0.628255,5.0,10,0
676864501615042560,2015-12-15 20:40:47,Meet Ash. He's just a head now. Lost his body during the Third Crusade. Still in good spirits. 10/10 would pet well https://t.co/NJj2uP0atK,0,139,802,2278,1,chesapeake_bay_retriever,0.371146,10.0,10,Ash
676821958043033607,2015-12-15 17:51:44,Finally some constructive political change in this country. 11/10 https://t.co/mvQaETHVSb,0,89,17503,25013,2,great_pyrenees,0.8698040000000001,11.0,10,0
676819651066732545,2015-12-15 17:42:34,Watch out Airbud. This pupper is also good at the sports. 12/10 I'm thinking D1 https://t.co/1HrFdo7M0C,pupper,103,738,1949,2,rain_barrel,0.625555,12.0,10,0
676811746707918848,2015-12-15 17:11:09,Say hello to Penny &amp; Gizmo. They are practicing their caroling. The ambition in the room is tangible. 9/10 for both https://t.co/aqBHjjh5VD,0,143,468,1526,1,chihuahua,0.440916,9.0,10,0
676776431406465024,2015-12-15 14:50:49,"When someone yells ""cops!"" at a party and you gotta get your drunk friend out of there. 10/10 https://t.co/4rMZi5Ca1k",0,117,2233,5377,1,doormat,0.201346,10.0,10,0
676617503762681856,2015-12-15 04:19:18,I promise this wasn't meant to be a cuteness overload account but ermergerd look at this cozy pupper. 13/10 https://t.co/mpQl2rJjDh,pupper,131,1103,3123,1,chihuahua,0.841084,13.0,10,0
676613908052996102,2015-12-15 04:05:01,This is the saddest/sweetest/best picture I've been sent. 12/10 ðŸ˜¢ðŸ¶ https://t.co/vQ2Lw1BLBF,0,90,219,1172,1,book_jacket,0.49379,12.0,10,0
676606785097199616,2015-12-15 03:36:42,*screeches for a sec and then faints* 12/10 https://t.co/N5QL4ySBEx,0,67,488,2029,1,loafer,0.202999,12.0,10,0
676603393314578432,2015-12-15 03:23:14,This is Godzilla pupper. He had a ruff childhood &amp; now deflects that pain outward by terrorizing cities. Tragic 9/10 https://t.co/g1tLGkyaxr,pupper,144,440,1268,1,whippet,0.8770209999999999,9.0,10,0
676588346097852417,2015-12-15 02:23:26,This is Bubbles. He kinda resembles a fish. Always makes eye contact with u no matter what. Sneaky tongue slip. 5/10 https://t.co/Nrhvc5tLFT,0,140,893,2519,1,boston_bull,0.976577,5.0,10,Bubbles
676582956622721024,2015-12-15 02:02:01,"Meet Vinnie. He's having fun while being safe. Well not a lot of fun, but definitely safe, and that's important 8/10 https://t.co/vZYtynZZlH",0,140,311,1299,1,seat_belt,0.790028,8.0,10,Vinnie
676575501977128964,2015-12-15 01:32:24,This pupper is very passionate about Christmas. Wanted to give the tree a hug. So cute. 8/10 https://t.co/NsGyECJuq7,pupper,116,1252,2794,1,feather_boa,0.424106,8.0,10,0
676533798876651520,2015-12-14 22:46:41,ITSOFLUFFAYYYYY 12/10 https://t.co/bfw13CnuuZ,0,45,618,2018,1,chow,0.26527399999999995,12.0,10,0
676496375194980353,2015-12-14 20:17:59,Say hello to Griffin. He's upset because his costume for Halloween didn't arrive until today. 9/10 cheer up pup https://t.co/eoBCjSFajX,0,135,601,1631,1,pug,0.985387,9.0,10,Griffin
676470639084101634,2015-12-14 18:35:43,Three generations of pupper. 11/10 for all https://t.co/tAmQYvzrau,pupper,66,5197,12568,1,golden_retriever,0.7903859999999999,11.0,10,0
676440007570247681,2015-12-14 16:34:00,Hope your Monday isn't too awful. Here's two baseball puppers. 11/10 for each https://t.co/dB0H9hdZai,pupper,101,740,1853,2,maltese_dog,0.579472,11.0,10,0
676430933382295552,2015-12-14 15:57:56,"Meet Duke. He's an Urban Parmesan. They know he's scared of the green rubber dog. ""Why u do dis?"" thinks Duke. 10/10 https://t.co/3bim9U5Idr",0,140,385,1519,1,golden_retriever,0.583875,10.0,10,Duke
676263575653122048,2015-12-14 04:52:55,All this pupper wanted to do was go skiing. No one told him about the El NiÃ±o. Poor pupper. 10/10 maybe next year https://t.co/fTgbq1UBR9,pupper,137,605,2233,1,teddy,0.0982826,10.0,10,0
676237365392908289,2015-12-14 03:08:46,Say hello to Winston. He has no respect for the system. Much rebellion. I think that's a palm tree... nice. 8/10 https://t.co/dOLQddhXLZ,0,136,331,1325,1,french_bulldog,0.961996,8.0,10,Winston
676219687039057920,2015-12-14 01:58:31,This is Kenneth. He's stuck in a bubble. 10/10 hang in there Kenneth https://t.co/uQt37xlYMJ,0,92,31810,66833,1,bubble,0.997556,10.0,10,Kenneth
676215927814406144,2015-12-14 01:43:35,This is Herm. He just wants to be like the other dogs. Sneaky tongue slip. Super fuzzy. 9/10 would cuddle firmly https://t.co/tg8h9lzCHv,0,136,655,1873,1,hamster,0.999484,9.0,10,Herm
676191832485810177,2015-12-14 00:07:50,These two pups just met and have instantly bonded. Spectacular scene. Mesmerizing af. 10/10 and 7/10 for blue dog https://t.co/gwryaJO4tC,0,137,1142,2464,2,chihuahua,0.376741,10.0,10,0
676146341966438401,2015-12-13 21:07:04,This is Bert. He likes flowers. 10/10 https://t.co/lmQRrNxaQu,0,61,739,2068,1,irish_water_spaniel,0.388332,10.0,10,Bert
676101918813499392,2015-12-13 18:10:33,Meet Striker. He's ready for Christmas. 11/10 https://t.co/B3xxSLjQSH,0,69,1280,3027,1,shih-tzu,0.225848,11.0,10,Striker
676098748976615425,2015-12-13 17:57:57,Extremely rare pup here. Very religious. Always praying. Too many legs. Not overwhelmingly fluffy. Won't bark. 3/10 https://t.co/REyE5YKVBb,0,139,1610,3259,1,walking_stick,0.162179,3.0,10,0
676089483918516224,2015-12-13 17:21:08,"""Yes hello I'ma just snag this here toasted bagel real quick. carry on."" 9/10 https://t.co/Cuz0Osnekp",0,101,479,1422,1,bull_mastiff,0.743808,9.0,10,0
675898130735476737,2015-12-13 04:40:46,I'm sure you've all seen this pupper. Not prepared at all for the flying disc of terror. 10/10 https://t.co/G0pQiFGM7O,pupper,118,651,1766,1,labrador_retriever,0.40743,10.0,10,0
675891555769696257,2015-12-13 04:14:39,This is Donny. He's summoning the demon monster Babadook. 6/10 Donny please no that won't be a good time for anyone https://t.co/kiW6Knb7Gp,0,139,971,2286,1,italian_greyhound,0.305637,6.0,10,Donny
675888385639251968,2015-12-13 04:02:03,Breathtaking scene. A father taking care of his newborn pup. Tugs at the heartstrings. 10/10 restores my faith https://t.co/06oZdehGEa,0,134,1063,2571,1,west_highland_white_terrier,0.672117,10.0,10,0
675878199931371520,2015-12-13 03:21:34,"Ok, I'll admit this is a pretty adorable bunny hopping towards the ocean but please only send in dogs... 11/10 https://t.co/sfsVCGIipI",0,134,1562,4506,1,wood_rabbit,0.785756,11.0,10,0
675870721063669760,2015-12-13 02:51:51,&amp; this is Yoshi. Another world record contender 11/10 (what the hell is happening why are there so many contenders?) https://t.co/QG708dDNH6,0,144,628,1771,1,golden_retriever,0.263892,11.0,10,0
675853064436391936,2015-12-13 01:41:41,Here we have an entire platoon of puppers. Total score: 88/80 would pet all at once https://t.co/y93p6FLvVw,pupper,107,1447,2903,1,labrador_retriever,0.868367,11.0,10,0
675845657354215424,2015-12-13 01:12:15,"This is Pepper. She's not fully comfortable riding her imaginary bike yet. 10/10 don't worry pupper, it gets easier https://t.co/40dj4eTsXG",pupper,139,991,2460,1,pug,0.8839520000000001,10.0,10,Pepper
675822767435051008,2015-12-12 23:41:18,ðŸŽ¶ HELLO FROM THE OTHER SIIIIIIIIDE ðŸŽ¶ 10/10s https://t.co/GK2HJtkdQk,0,67,589,1644,1,pomeranian,0.4607100000000001,10.0,10,0
675820929667219457,2015-12-12 23:34:00,Here's a handful of sleepy puppers. All look unaware of their surroundings. Lousy guard dogs. Still cute tho 11/10s https://t.co/lyXX3v5j4s,pupper,139,259,1130,1,basset,0.556373,11.0,10,0
675798442703122432,2015-12-12 22:04:39,This is Bernie. He just touched a boob for the first time. 10/10 https://t.co/whQKMygnK6,0,88,3769,11049,1,beagle,0.681218,10.0,10,Bernie
675781562965868544,2015-12-12 20:57:34,Say hello to Buddah. He was Waldo for Halloween. 11/10 https://t.co/DVAqAnb624,0,78,531,1741,1,maltese_dog,0.921968,11.0,10,Buddah
675740360753160193,2015-12-12 18:13:51,Here's a pupper licking in slow motion. 12/10 please enjoy https://t.co/AUJi8ujxw9,pupper,82,387,1250,1,golden_retriever,0.800495,12.0,10,0
675710890956750848,2015-12-12 16:16:45,This is Lenny. He was just told that he couldn't explore the fish tank. 12/10 smh all that work for nothing https://t.co/JWi6YrpiO1,0,131,922,2039,2,standard_schnauzer,0.4414270000000001,12.0,10,Lenny
675707330206547968,2015-12-12 16:02:36,We've got ourselves a battle here. Watch out Reggie. 11/10 https://t.co/ALJvbtcwf0,0,82,767,2141,1,bath_towel,0.721933,11.0,10,0
675706639471788032,2015-12-12 15:59:51,This is a Sizzlin Menorah spaniel from Brooklyn named Wylie. Lovable eyes. Chiller as hell. 10/10 and I'm out.. poof https://t.co/7E0AiJXPmI,0,140,106,689,1,english_springer,0.9903,10.0,10,0
675534494439489536,2015-12-12 04:35:48,Seriously guys?! Only send in dogs. I only rate dogs. This is a baby black bear... 11/10 https://t.co/H7kpabTfLj,0,112,468,1940,1,chow,0.749368,11.0,10,0
675531475945709568,2015-12-12 04:23:49,This is Ellie AKA Queen Slayer of the Orbs. Very self-motivated. Great yard. Rad foliage. 10/10 would pet diligently https://t.co/c9jmg3Xtzn,0,140,428,1265,1,pembroke,0.918441,10.0,10,0
675522403582218240,2015-12-12 03:47:46,Meet Sammy. He's a Motorola Firefox. Hat under hoodie (must be a half-decent up and coming white rapper) 10/10 https://t.co/rO2zxf0OQ0,0,134,312,1113,1,cocker_spaniel,0.299708,10.0,10,Sammy
675517828909424640,2015-12-12 03:29:35,12/10 stay woke https://t.co/XDiQw4Akiw,0,39,503,1405,1,scottish_deerhound,0.240591,12.0,10,0
675501075957489664,2015-12-12 02:23:01,"I shall call him squishy and he shall be mine, and he shall be my squishy. 13/10 https://t.co/WId5lxNdPH",0,104,6454,18404,1,dough,0.806757,13.0,10,0
675497103322386432,2015-12-12 02:07:14,Meet Reggie. He's going for the world record. Must concentrate. Focus up pup. 11/10 we all believe in you Reggie https://t.co/h3AWz4AzuC,0,136,1437,3377,1,vizsla,0.5195890000000001,11.0,10,Reggie
675489971617296384,2015-12-12 01:38:53,RT until we find this dog. Clearly a cool dog (front leg relaxed out window). Looks to be a superb driver. 10/10 https://t.co/MnTrKaQ8Wn,0,136,669,1395,1,west_highland_white_terrier,0.139613,10.0,10,0
675483430902214656,2015-12-12 01:12:54,Rare shielded battle dog here. Very happy about abundance of lettuce. Painfully slow fetcher. Still petable. 5/10 https://t.co/C3tlKVq7eO,0,137,1076,1982,1,box_turtle,0.543706,5.0,10,0
675432746517426176,2015-12-11 21:51:30,Happy Friday. Here's some golden puppers. 12/10 for all https://t.co/wNkqAED6lG,pupper,79,626,1619,1,labrador_retriever,0.986548,12.0,10,0
675372240448454658,2015-12-11 17:51:04,"The tail alone is 13/10. Great dog, better owner https://t.co/IyAXinfyju",0,72,558,1832,1,chihuahua,0.4163850000000001,13.0,10,0
675362609739206656,2015-12-11 17:12:48,This is Daisy. She loves that shoe. Still no seat belt. Super churlish. 12/10 the dogs are killing it today https://t.co/cZlkvgRPdn,0,131,260,1133,1,labrador_retriever,0.479008,12.0,10,Daisy
675354435921575936,2015-12-11 16:40:19,Everyone needs to watch this. 13/10 https://t.co/Bb3xnpsWBC,0,59,18880,35075,1,upright,0.303415,13.0,10,0
675349384339542016,2015-12-11 16:20:15,Yea I lied. Here's more. All 13/10 https://t.co/ZQZf2U4xCP,0,58,2520,4230,3,borzoi,0.866367,13.0,10,0
675334060156301312,2015-12-11 15:19:21,Good morning here's a grass pupper. 12/10 https://t.co/2d68FmWGGs,pupper,65,1428,2994,2,pembroke,0.773135,12.0,10,0
675166823650848770,2015-12-11 04:14:49,This is Arnold. He broke his leg saving a handicapped child from a forest fire. True hero. 10/10 inspirational dog https://t.co/bijCeHeX4C,0,138,1783,3895,1,llama,0.284394,10.0,10,Arnold
675153376133427200,2015-12-11 03:21:23,What kind of person sends in a picture without a dog in it? 1/10 just because that's a nice table https://t.co/RDXCfk8hK0,0,121,2724,6033,1,paper_towel,0.327957,1.0,10,0
675149409102012420,2015-12-11 03:05:37,holy shit 12/10 https://t.co/p6O8X93bTQ,0,39,1870,4017,1,chow,0.999876,12.0,10,0
675147105808306176,2015-12-11 02:56:28,When you're presenting a group project and the 4th guy tells the teacher that he did all the work. 10/10 https://t.co/f50mbB4UWS,0,128,273,1020,1,golden_retriever,0.949215,10.0,10,0
675146535592706048,2015-12-11 02:54:12,This is Coops. He's yelling at the carpet. Not very productive Coops. 7/10 https://t.co/Uz52oYnHzF,0,98,345,1292,1,dingo,0.28844699999999995,7.0,10,Coops
675145476954566656,2015-12-11 02:49:59,What an honor. 3 dogs here. Blond one is clearly a gymnast. Other two just confused. Very nifty pups. 9/10 for all https://t.co/YDgstgIDGs,0,138,1001,2294,1,labrador_retriever,0.458746,9.0,10,0
675135153782571009,2015-12-11 02:08:58,This is Steven. He got locked outside. Damn it Steven. 5/10 nice grill tho https://t.co/zf7Sxxjfp3,0,98,537,1388,1,stove,0.587507,5.0,10,Steven
675113801096802304,2015-12-11 00:44:07,Meet Zuzu. He just graduated college. Astute pupper. Needs 2 leashes to contain him. Wasn't ready for the pic. 10/10 https://t.co/2H5SKmk0k7,pupper,140,874,2109,1,bow,0.16802,10.0,10,Zuzu
675111688094527488,2015-12-11 00:35:44,Say hello to Oliver. He thought what was inside the pillow should be outside the pillow. Blurry since birth. 8/10 https://t.co/lFU9W31Fg9,0,137,280,1036,1,labrador_retriever,0.631501,8.0,10,Oliver
675109292475830276,2015-12-11 00:26:12,C'mon guys. We've been over this. We only rate dogs. This is a cow. Please only submit dogs. Thank you...... 9/10 https://t.co/WjcELNEqN2,0,137,1250,2991,1,dalmatian,0.989519,9.0,10,0
675047298674663426,2015-12-10 20:19:52,This is a fluffy albino Bacardi Columbia mix. Excellent at the tweets. 11/10 would hug gently https://t.co/diboDRUuEI,0,117,363,1136,1,samoyed,0.978007,11.0,10,0
675015141583413248,2015-12-10 18:12:05,Meet Moe. He's a golden Fetty Woof. Doesn't respect the authorities. Might own a motorhome? 10/10 revolutionary pup https://t.co/JAncIdNp8G,0,139,1330,2908,1,street_sign,0.290091,10.0,10,Moe
675006312288268288,2015-12-10 17:37:00,Say hello to Mollie. This pic was taken after she bet all her toys on Ronda Rousey. 10/10 hang in there pupper https://t.co/QMmAqA9VqO,pupper,134,251,1051,1,boxer,0.654697,10.0,10,Mollie
675003128568291329,2015-12-10 17:24:21,Meet Laela. She's adorable. Magnificent eyes. But I don't see a seat belt. Insubordinate.. and churlish. Still 12/10 https://t.co/pCGDgLkLo6,0,140,517,1664,1,pembroke,0.655279,12.0,10,Laela
674999807681908736,2015-12-10 17:11:09,Ok last one of these. I may try to make some myself. Anyway here ya go. 13/10 https://t.co/i9CDd1oEu8,0,101,1228,2417,1,rottweiler,0.591829,13.0,10,0
674805413498527744,2015-12-10 04:18:42,"When your entire life is crumbling before you and you're trying really hard to hold your shit together.
10/10 https://t.co/vqFkgYPCW8",0,133,391,931,1,english_springer,0.594467,10.0,10,0
674800520222154752,2015-12-10 03:59:15,This is Tedders. He broke his leg saving babies from the Pompeii eruption. 11/10 where's his Purple Heart? @POTUS https://t.co/cMI2AcLm4B,0,137,947,3221,1,pembroke,0.8764790000000001,11.0,10,Tedders
674793399141146624,2015-12-10 03:30:58,I have found another. 13/10 https://t.co/HwroPYv8pY,0,51,1217,2679,1,giant_schnauzer,0.119693,13.0,10,0
674790488185167872,2015-12-10 03:19:24,ER... MER... GERD 13/10 https://t.co/L1puJISV1a,0,47,277,1177,1,labrador_retriever,0.8019029999999999,13.0,10,0
