id,timestamp,text,actual_catg,display_text_range,retweet_count,favorite_count,img_num,p1,p1_conf,rate,rate_deno,name_1
892420643555336193,2017-08-01 16:23:56,This is Phineas. He's a mystical boy. Only ever appears in the hole of a donut. 13/10 https://t.co/MgUWQ76dJU,0,85,8842,39492,1,orange,0.0970486,13.0,10,Phineas
892177421306343426,2017-08-01 00:17:27,"This is Tilly. She's just checking pup on you. Hopes you're doing ok. If not, she's available for pats, snugs, boops, the whole bit. 13/10 https://t.co/0Xxu71qeIV",0,138,6480,33786,1,chihuahua,0.323581,13.0,10,Tilly
891815181378084864,2017-07-31 00:18:03,This is Archie. He is a rare Norwegian Pouncing Corgo. Lives in the tall grass. You never know when one may strike. 12/10 https://t.co/wUnZnhtVJB,0,121,4301,25445,1,chihuahua,0.716012,12.0,10,Archie
891689557279858688,2017-07-30 15:58:51,This is Darla. She commenced a snooze mid meal. 13/10 happens to the best of us https://t.co/tD36da7qLQ,0,79,8925,42863,1,paper_towel,0.17027799999999998,13.0,10,Darla
891327558926688256,2017-07-29 16:00:24,"This is Franklin. He would like you to stop calling him ""cute."" He is a very fierce shark and should be respected as such. 12/10 #BarkWeek https://t.co/AtUZn91f7f",0,138,9721,41016,2,basset,0.555712,12.0,10,Franklin
891087950875897856,2017-07-29 00:08:17,Here we have a majestic great white breaching off South Africa's coast. Absolutely h*ckin breathtaking. 13/10 (IG: tucker_marlo) #BarkWeek https://t.co/kQ04fDDRmh,0,138,3240,20548,1,chesapeake_bay_retriever,0.425595,13.0,10,0
890971913173991426,2017-07-28 16:27:12,"Meet Jax. He enjoys ice cream so much he gets nervous around it. 13/10 help Jax enjoy more things by clicking below

https://t.co/Zr4hWfAs1H https://t.co/tVJBRMnhxl",0,140,2142,12053,1,appenzeller,0.34170300000000003,13.0,10,Jax
890729181411237888,2017-07-28 00:22:40,When you watch your owner call another dog a good boy but then they turn back to you and say you're a great boy. 13/10 https://t.co/v0nONBcwxq,0,118,19548,66596,2,pomeranian,0.566142,13.0,10,0
890609185150312448,2017-07-27 16:25:51,This is Zoey. She doesn't want to be one of the scary sharks. Just wants to be a snuggly pettable boatpet. 13/10 #BarkWeek https://t.co/9TwLuAGH0b,0,122,4403,28187,1,irish_terrier,0.487574,13.0,10,Zoey
890240255349198849,2017-07-26 15:59:51,This is Cassie. She is a college pup. Studying international doggo communication and stick theory. 14/10 so elegant much sophisticate https://t.co/t1bfwz5S2A,doggo,133,7684,32467,1,pembroke,0.511319,14.0,10,Cassie
890006608113172480,2017-07-26 00:31:25,This is Koda. He is a South Australian deckshark. Deceptively deadly. Frighteningly majestic. 13/10 would risk a petting #BarkWeek https://t.co/dVPW0B0Mme,0,130,7584,31127,1,samoyed,0.957979,13.0,10,Koda
889880896479866881,2017-07-25 16:11:53,This is Bruno. He is a service shark. Only gets out of the water to assist you. 13/10 terrifyingly good boy https://t.co/u1XPQMl29g,0,107,5116,28208,1,french_bulldog,0.377417,13.0,10,Bruno
889665388333682689,2017-07-25 01:55:32,Here's a puppo that seems to be on the fence about something haha no but seriously someone help her. 13/10 https://t.co/BxvuXk0UCm,puppo,106,8502,38745,1,pembroke,0.966327,13.0,10,0
889638837579907072,2017-07-25 00:10:02,This is Ted. He does his best. Sometimes that's not enough. But it's ok. 12/10 would assist https://t.co/f8dEDcrKSR,0,91,4705,27633,1,french_bulldog,0.99165,12.0,10,Ted
889531135344209921,2017-07-24 17:02:04,This is Stuart. He's sporting his favorite fanny pack. Secretly filled with bones only. 13/10 puppared puppo #BarkWeek https://t.co/y70o6h3isq,puppo,118,2309,15329,1,golden_retriever,0.953442,13.0,10,Stuart
889278841981685760,2017-07-24 00:19:32,This is Oliver. You're witnessing one of his many brutal attacks. Seems to be playing with his victim. 13/10 fr*ckin frightening #BarkWeek https://t.co/WpHvrQedPb,0,138,5635,25712,1,whippet,0.626152,13.0,10,Oliver
888917238123831296,2017-07-23 00:22:39,This is Jim. He found a fren. Taught him how to sit like the good boys. 12/10 for both https://t.co/chxruIOUJN,0,86,4681,29555,1,golden_retriever,0.714719,12.0,10,Jim
888804989199671297,2017-07-22 16:56:37,This is Zeke. He has a new stick. Very proud of it. Would like you to throw it for him without taking it. 13/10 would do my best https://t.co/HTQ77yNQ5K,0,128,4535,26021,1,golden_retriever,0.46976,13.0,10,Zeke
888554962724278272,2017-07-22 00:23:06,This is Ralphus. He's powering up. Attempting maximum borkdrive. 13/10 inspirational af https://t.co/YnYAFCTTiK,0,87,3722,20267,3,siberian_husky,0.700377,13.0,10,Ralphus
888078434458587136,2017-07-20 16:49:33,This is Gerald. He was just told he didn't get the job he interviewed for. A h*ckin injustice. 12/10 didn't want the job anyway https://t.co/DK7iDPfuRX,0,127,3637,22144,1,french_bulldog,0.995026,12.0,10,Gerald
887705289381826560,2017-07-19 16:06:48,This is Jeffrey. He has a monopoly on the pool noodles. Currently running a 'boop for two' midweek sale. 13/10 h*ckin strategic https://t.co/PhrUk20Q64,0,127,5584,30690,1,basset,0.821664,13.0,10,Jeffrey
887517139158093824,2017-07-19 03:39:09,I've yet to rate a Venezuelan Hover Wiener. This is such an honor. 14/10 paw-inspiring af (IG: roxy.thedoxy) https://t.co/20VrLAA8ba,0,108,12053,46940,1,limousine,0.130432,14.0,10,0
887473957103951883,2017-07-19 00:47:34,This is Canela. She attempted some fancy porch pics. They were unsuccessful. 13/10 someone help her https://t.co/cLyzpcUcMX,0,99,18813,70007,2,pembroke,0.809197,13.0,10,Canela
887343217045368832,2017-07-18 16:08:03,You may not have known you needed to see this today. 13/10 please enjoy (IG: emmylouroo) https://t.co/WZqNqygEyV,0,88,10713,34223,1,mexican_hairless,0.330741,13.0,10,0
887101392804085760,2017-07-18 00:07:08,This... is a Jubilant Antarctic House Bear. We only rate dogs. Please only send dogs. Thank you... 12/10 would suffocate in floof https://t.co/4Ad1jzJSdp,0,129,6147,31045,1,samoyed,0.733942,12.0,10,0
886983233522544640,2017-07-17 16:17:36,This is Maya. She's very shy. Rarely leaves her cup. 13/10 would find her an environment to thrive in https://t.co/I6oNy0CgiT,0,101,8045,35786,2,chihuahua,0.793469,13.0,10,Maya
886736880519319552,2017-07-16 23:58:41,"This is Mingus. He's a wonderful father to his smol pup. Confirmed 13/10, but he needs your help

https://t.co/bVi0Yr4Cff https://t.co/ISvKOSkd5b",0,121,3420,12286,1,kuvasz,0.309706,13.0,10,Mingus
886680336477933568,2017-07-16 20:14:00,This is Derek. He's late for a dog meeting. 13/10 pet...al to the metal https://t.co/BCoWue0abA,0,71,4597,22802,1,convertible,0.738995,13.0,10,Derek
886366144734445568,2017-07-15 23:25:31,This is Roscoe. Another pupper fallen victim to spontaneous tongue ejections. Get the BlepiPen immediate. 12/10 deep breaths Roscoe https://t.co/RGE08MIJox,pupper,131,3297,21488,1,french_bulldog,0.999201,12.0,10,Roscoe
886258384151887873,2017-07-15 16:17:19,This is Waffles. His doggles are pupside down. Unsure how to fix. 13/10 someone assist Waffles https://t.co/xZDA9Qsq1O,0,94,6506,28437,1,pug,0.943575,13.0,10,Waffles
885984800019947520,2017-07-14 22:10:11,Viewer discretion advised. This is Jimbo. He will rip ur finger right h*ckin off. Other dog clearly an accessory. 12/10 pls pet with caution https://t.co/BuveP0uMF1,0,140,7043,33299,1,blenheim_spaniel,0.972494,12.0,10,Jimbo
885528943205470208,2017-07-13 15:58:47,This is Maisey. She fell asleep mid-excavation. Happens to the best of us. 13/10 would pat noggin approvingly https://t.co/tp1kQ8i9JF,0,109,6642,36592,1,pug,0.369275,13.0,10,Maisey
885167619883638784,2017-07-12 16:03:00,Here we have a corgi undercover as a malamute. Pawbably doing important investigative work. Zero control over tongue happenings. 13/10 https://t.co/44ItaMubBf,0,134,4526,22304,4,malamute,0.8124819999999999,13.0,10,0
884925521741709313,2017-07-12 00:01:00,"This is Earl. He found a hat. Nervous about what you think of it. 12/10 it's delightful, Earl https://t.co/MYJvdlNRVa",0,93,19149,78881,1,italian_greyhound,0.259916,12.0,10,Earl
884876753390489601,2017-07-11 20:47:12,This is Lola. It's her first time outside. Must test the earth and taste the atmosphere. 13/10 you're doing great Lola https://t.co/74TKAUsLkO,0,118,6042,28429,1,chow,0.822103,13.0,10,Lola
884562892145688576,2017-07-11 00:00:02,This is Kevin. He's just so happy. 13/10 what is your secret Kevin https://t.co/1r4MFCbCX5,0,66,5076,24716,1,pug,0.5464060000000001,13.0,10,Kevin
884441805382717440,2017-07-10 15:58:53,"I present to you, Pup in Hat. Pup in Hat is great for all occasions. Extremely versatile. Compact as h*ck. 14/10 (IG: itselizabethgales) https://t.co/vvBOcC2VdC",0,136,5836,27443,1,pembroke,0.993225,14.0,10,0
884162670584377345,2017-07-09 21:29:42,Meet Yogi. He doesn't have any important dog meetings today he just enjoys looking his best at all times. 12/10 for dangerously dapper doggo https://t.co/YSI00BzTBZ,doggo,140,3099,20719,1,german_shepherd,0.707046,12.0,10,Yogi
883838122936631299,2017-07-09 00:00:04,This is Noah. He can't believe someone made this mess. Got the vacuum out for you though. Offered to help clean pup. 12/10 super good boy https://t.co/V85xujjDDY,0,137,3559,22269,1,doberman,0.610946,12.0,10,Noah
883482846933004288,2017-07-08 00:28:19,"This is Bella. She hopes her smile made you smile. If not, she is also offering you her favorite monkey. 13.5/10 https://t.co/qjrljjt948",0,112,10336,46741,1,golden_retriever,0.943082,13.5,10,Bella
883360690899218434,2017-07-07 16:22:55,Meet Grizzwald. He may be the floofiest floofer I ever did see. Lost eyes saving a schoolbus from a volcano erpuption. 13/10 heroic as h*ck https://t.co/rf661IFEYP,floofer,139,3802,22932,1,chow,0.987997,13.0,10,Grizzwald
883117836046086144,2017-07-07 00:17:54,"Please only send dogs. We don't rate mechanics, no matter how h*ckin good. Thank you... 13/10 would sneak a pat https://t.co/Se5fZ9wp5E",0,111,6900,37810,2,golden_retriever,0.949562,13.0,10,0
882992080364220416,2017-07-06 15:58:11,This is Rusty. He wasn't ready for the first pic. Clearly puppared for the second. 13/10 confirmed great boy https://t.co/tyER0KpdXj,0,108,4086,24358,1,eskimo_dog,0.466778,13.0,10,Rusty
882762694511734784,2017-07-06 00:46:41,This is Gus. He's quite the cheeky pupper. Already perfected the disinterested wink. 12/10 would let steal my girl https://t.co/D43I96SlVu,pupper,114,5086,28810,1,labrador_retriever,0.85005,12.0,10,Gus
882627270321602560,2017-07-05 15:48:34,This is Stanley. He has his first swim lesson today. Doggle straps adjusted. Ready to go. 13/10 Phelps is nervous (IG: stanleythe_corgi) https://t.co/Nx52PGwH94,0,136,6303,28327,1,pembroke,0.542982,13.0,10,Stanley
882268110199369728,2017-07-04 16:01:23,This is Alfy. You're witnessing his first watermelon experience. I think it was a success. 13/10 happy 4th Alfy ðŸ‡ºðŸ‡¸ https://t.co/fYP5RlutfA,0,114,12013,45745,1,golden_retriever,0.762211,13.0,10,Alfy
882045870035918850,2017-07-04 01:18:17,"This is Koko. Her owner, inspired by Barney, recently built a cart for her to use during walks if she got tired. 13/10 rest easy Koko https://t.co/zeDpnsKX7w",0,133,5162,29843,1,web_site,0.949591,13.0,10,Koko
881906580714921986,2017-07-03 16:04:48,This is Rey. He's a Benebop Cumberfloof. 12/10 dangerously pettable https://t.co/503CgWbhxQ,0,67,3516,24708,1,weimaraner,0.291539,12.0,10,Rey
881666595344535552,2017-07-03 00:11:11,This is Gary. He couldn't miss this puppertunity for a selfie. Flawless focusing skills. 13/10 would boop intensely https://t.co/7CSWCl8I6s,pupper,115,11026,51390,1,saluki,0.529012,13.0,10,Gary
881536004380872706,2017-07-02 15:32:16,"Here is a pupper approaching maximum borkdrive. Zooming at never before seen speeds. 14/10 paw-inspiring af 
(IG: puffie_the_chow) https://t.co/ghXBIIeQZF",pupper,130,16564,50326,1,samoyed,0.281463,14.0,10,0
881268444196462592,2017-07-01 21:49:04,Meet Elliot. He's a Canadian Forrest Pup. Unusual number of antlers for a dog. Sneaky tongue slip to celebrate #Canada150. 12/10 would pet https://t.co/cgwJwowTMC,0,138,5328,23462,1,tusker,0.473303,12.0,10,Elliot
880935762899988482,2017-06-30 23:47:07,This is Louis. He's crossing. It's a big deal. 13/10 h*ckin breathtaking https://t.co/D0wb1GlKAt,0,72,2871,17288,1,street_sign,0.251801,13.0,10,Louis
880872448815771648,2017-06-30 19:35:32,Ugh not again. We only rate dogs. Please don't send in well-dressed  floppy-tongued street penguins. Dogs only please. Thank you... 12/10 https://t.co/WiAMbTkDPf,0,137,3957,21667,1,pembroke,0.791416,12.0,10,0
880465832366813184,2017-06-29 16:39:47,This is Bella. She had her first beach experience this morning. Complete success. 12/10 would perform a sandy boop https://t.co/4VsFysDmiw,0,114,6500,28997,1,golden_retriever,0.913255,12.0,10,Bella
880221127280381952,2017-06-29 00:27:25,Meet Jesse. He's a Fetty Woof. His tongue ejects without warning. A true bleptomaniac. 12/10 would snug well https://t.co/fUod0tVmvK,0,108,4398,27561,1,chihuahua,0.238525,12.0,10,Jesse
880095782870896641,2017-06-28 16:09:20,Please don't send in photos without dogs in them. We're not @porch_rates. Insubordinate and churlish. Pretty good porch tho 11/10 https://t.co/HauE8M3Bu4,0,129,4506,28085,1,miniature_pinscher,0.120298,11.0,10,0
879862464715927552,2017-06-28 00:42:13,This is Romeo. He would like to do an entrance. Requesting your immediate assistance. 13/10 https://t.co/Qh5aEkRQm9,0,91,3615,22609,3,basset,0.813507,13.0,10,Romeo
879492040517615616,2017-06-27 00:10:17,This is Bailey. He thinks you should measure ear length for signs of growth instead. 12/10 https://t.co/IxM9IMKQq8,0,90,3300,23778,1,german_short-haired_pointer,0.479896,12.0,10,Bailey
879415818425184262,2017-06-26 19:07:24,This is Duddles. He did an attempt. 13/10 someone help him (vid by Georgia Felici) https://t.co/UDT7ZkcTgY,0,82,45655,107834,1,english_springer,0.383404,13.0,10,Duddles
879376492567855104,2017-06-26 16:31:08,This is Jack AKA Stephen Furry. You're not scoring on him. Unless he slips down the slide. 12/10 would happily get blocked by https://t.co/0gOi601EAa,0,125,3239,17061,1,tricycle,0.663601,12.0,10,0
879050749262655488,2017-06-25 18:56:45,This is Steven. He has trouble relating to other dogs. Quite shy. Neck longer than average. Tropical probably. 11/10 would still pet https://t.co/2mJCDEJWdD,0,132,4890,22978,1,tabby,0.311861,11.0,10,Steven
879008229531029506,2017-06-25 16:07:47,This is Beau. That is Beau's balloon. He takes it everywhere. 13/10 would protect at all costs https://t.co/YDtpCjIPKN,0,94,2793,19265,1,vizsla,0.960513,13.0,10,Beau
878776093423087618,2017-06-25 00:45:22,This is Snoopy. He's a proud #PrideMonthPuppo. Impeccable handwriting for not having thumbs. 13/10 would love back #PrideMonth https://t.co/lNZwgNO4gS,puppo,126,4282,19708,2,italian_greyhound,0.734684,13.0,10,Snoopy
878281511006478336,2017-06-23 16:00:04,"Meet Shadow. In an attempt to reach maximum zooming borkdrive, he tore his ACL. Still 13/10 tho. Help him out below

https://t.co/245xJJElsY https://t.co/lUiQH219v6",0,140,1338,7890,1,basset,0.32042,13.0,10,Shadow
878057613040115712,2017-06-23 01:10:23,This is Emmy. She was adopted today. Massive round of pupplause for Emmy and her new family. 14/10 for all involved https://t.co/cwtWnHMVpe,0,115,7118,42743,1,french_bulldog,0.839097,14.0,10,Emmy
877736472329191424,2017-06-22 03:54:17,This is Aja. She was just told she's a good dog. Suspicions confirmed. 13/10 would tell again https://t.co/lsPyyAiF1r,0,93,19908,81450,2,chesapeake_bay_retriever,0.8379559999999999,13.0,10,Aja
877556246731214848,2017-06-21 15:58:08,This is Penny. She's both pupset and fired pup. Not pleased w your barbaric attempts at cleanliness. 12/10 would enjoy more shampoo options https://t.co/OYdDlfOGXP,0,139,3973,23188,1,basset,0.995368,12.0,10,Penny
877316821321428993,2017-06-21 00:06:44,"Meet Dante. At first he wasn't a fan of his new raincoat, then he saw his reflection. H*ckin handsome. 13/10 for water resistant good boy https://t.co/SHRTIo5pxc",0,137,5377,27835,1,saluki,0.5099670000000001,13.0,10,Dante
877201837425926144,2017-06-20 16:29:50,This is Nelly. He graduated with his dogtorate today. Wants to know if you're proud of him. 12/10 would give congratulatory boop https://t.co/4g4cfj3P4Y,0,128,5829,27661,1,pembroke,0.93112,12.0,10,Nelly
876838120628539392,2017-06-19 16:24:33,This is Ginger. She's having a ruff Monday. Too many pupper things going on. H*ckin exhausting. 12/10 would snug passionately https://t.co/j211oCDRs6,pupper,125,3493,21069,1,bloodhound,0.575751,12.0,10,Ginger
876484053909872640,2017-06-18 16:57:37,This is Benedict. He wants to thank you for this delightful urban walk. Hopes you know he loves you. 13/10 super duper good boy https://t.co/26BXueUgbs,0,127,2499,19086,1,golden_retriever,0.874566,13.0,10,Benedict
876120275196170240,2017-06-17 16:52:05,"Meet Venti, a seemingly caffeinated puppoccino. She was just informed the weekend would include walks, pats and scritches. 13/10 much excite https://t.co/ejExJFq3ek",puppo,140,4872,28392,1,bernese_mountain_dog,0.534327,13.0,10,0
875747767867523072,2017-06-16 16:11:53,"This is Goose. He's a womanizer. Cheeky as h*ck, but also deep. Tongue slip game on another level. 13/10 will steal your girl https://t.co/V2WlACRJCN",0,125,4478,25710,1,labrador_retriever,0.799551,13.0,10,Goose
875144289856114688,2017-06-15 00:13:52,Meet Nugget and Hank. Nugget took Hank's bone. Hank is wondering if you would please return it to him. Both 13/10 would not intervene https://t.co/ogith9ejNj,0,133,5114,22346,1,siberian_husky,0.245048,13.0,10,0
875021211251597312,2017-06-14 16:04:48,Guys please stop sending pictures without any dogs in th- oh never mind hello excuse me sir. 12/10 stealthy as h*ck https://t.co/brCQoqc8AW,0,115,4895,25948,2,west_highland_white_terrier,0.7143189999999999,12.0,10,0
874680097055178752,2017-06-13 17:29:20,Meet Cash. He hath acquired a stick. A very good stick tbh. 12/10 would pat head approvingly https://t.co/lZhtizkURD,0,92,4825,28371,1,labrador_retriever,0.836052,12.0,10,Cash
874296783580663808,2017-06-12 16:06:11,This is Jed. He may be the fanciest pupper in the game right now. Knows it too. 13/10 would sign modeling contract https://t.co/0YplNnSMEm,pupper,114,4284,26563,1,cocker_spaniel,0.437216,13.0,10,Jed
874057562936811520,2017-06-12 00:15:36,"I can't believe this keeps happening. This, is a birb taking a bath. We only rate dogs. Please only send dogs. Thank you... 12/10 https://t.co/pwY9PQhtP2",0,129,4107,23061,1,flat-coated_retriever,0.8321770000000001,12.0,10,0
874012996292530176,2017-06-11 21:18:31,"This is Sebastian. He can't see all the colors of the rainbow, but he can see that this flag makes his human happy. 13/10 #PrideMonth puppo https://t.co/XBE0evJZ6V",puppo,139,10926,35406,2,cardigan,0.806674,13.0,10,Sebastian
873580283840344065,2017-06-10 16:39:04,"We usually don't rate Deck-bound Saskatoon Black Bears, but this one is h*ckin flawless. Sneaky tongue slip too. 13/10 would hug firmly https://t.co/mNuMH9400n",0,135,4110,24757,1,newfoundland,0.678537,13.0,10,0
873213775632977920,2017-06-09 16:22:42,"This is Sierra. She's one precious pupper. Absolute 12/10. Been in and out of ICU her whole life. Help Sierra below

https://t.co/Xp01EU3qyD https://t.co/V5lkvrGLdQ",pupper,140,1656,7435,1,vizsla,0.6197819999999999,12.0,10,Sierra
872967104147763200,2017-06-09 00:02:31,Here's a very large dog. He has a date later. Politely asked this water person to check if his breath is bad. 12/10 good to go doggo https://t.co/EMYIdoblMR,doggo,132,5632,27918,2,labrador_retriever,0.476913,12.0,10,0
872820683541237760,2017-06-08 14:20:41,"Here are my favorite #dogsatpollingstations 
Most voted for a more consistent walking schedule and to increase daily pats tenfold. All 13/10 https://t.co/17FVMl4VZ5",0,140,3858,15006,3,pug,0.99912,13.0,10,0
872620804844003328,2017-06-08 01:06:27,This is Monkey. She's supporting owners everywhere with her fancy #PrideMonth bandana. 13/10 love is love is love... https://t.co/lUcpnZDPz9,0,116,3871,21254,1,cocker_spaniel,0.513191,13.0,10,Monkey
872486979161796608,2017-06-07 16:14:40,We. Only. Rate. Dogs. Do not send in other things like this fluffy floor shark clearly ready to attack. Get it together guys... 12/10 https://t.co/BZHiKx3FpQ,0,133,9365,41474,1,pembroke,0.931861,12.0,10,0
872261713294495745,2017-06-07 01:19:32,This is Harry. His ears are activated one at a time. Incredibly rare to witness in person. Very special moment here. 13/10 blessed as h*ck https://t.co/ejHvGDfWoa,0,138,6606,34982,2,labrador_retriever,0.972019,13.0,10,Harry
872122724285648897,2017-06-06 16:07:15,This is Kody. He's a baller. Wishes he was a little bit taller. Double dribbles often. Still 12/10 would happily get dunked on https://t.co/PKSpmiefwN,0,126,8493,35224,1,basketball,0.808396,12.0,10,Kody
871879754684805121,2017-06-06 00:01:46,Say hello to Lassie. She's celebrating #PrideMonth by being a splendid mix of astute and adorable. Proudly supupporting her owner. 13/10 https://t.co/uK6PNyeh9w,puppo,136,11810,38995,1,shetland_sheepdog,0.969171,13.0,10,Lassie
871762521631449091,2017-06-05 16:15:56,This is Rover. As part of pupper protocol he had to at least attempt to eat the plant. Confirmed not tasty. Needs peanut butter. 12/10 https://t.co/AiVljI6QCg,pupper,134,3641,20716,2,labrador_retriever,0.921393,12.0,10,Rover
871515927908634625,2017-06-04 23:56:03,This is Napolean. He's a Raggedy East Nicaraguan Zoom Zoom. Runs on one leg. Built for deception. No eyes. Good with kids. 12/10 great doggo https://t.co/PR7B7w1rUw,doggo,140,3608,20687,2,komondor,0.974781,12.0,10,Napolean
871032628920680449,2017-06-03 15:55:36,"This is Boomer. He's doing an advanced water takeoff. The opposite of Sully. Ears for control, mlem for style. 13/10 simply breathtaking https://t.co/noNpY2Laoo",0,136,3972,23174,1,kelpie,0.3980530000000001,13.0,10,Boomer
870804317367881728,2017-06-03 00:48:22,Real funny guys. Sending in a pic without a dog in it. Hilarious. We'll rate the rug tho because it's giving off a very good vibe. 11/10 https://t.co/GCD1JccCyi,0,136,6348,33689,1,home_theater,0.16829000000000002,11.0,10,0
870656317836468226,2017-06-02 15:00:16,"This is Cody. He zoomed too aggressively and tore his ACL. Happens to the best of us. Still 13/10

Help Cody here: https://t.co/4hxnDOt1CV https://t.co/42ryYRQ2Q4",0,138,2798,12767,4,pembroke,0.945495,13.0,10,Cody
870374049280663552,2017-06-01 20:18:38,This is Zoey. She really likes the planet. Would hate to see willful ignorance and the denial of fairly elemental science destroy it. 13/10 https://t.co/T1xlgaPujm,0,139,27502,84753,1,golden_retriever,0.841001,13.0,10,Zoey
870308999962521604,2017-06-01 16:00:09,"This is Rumble, but he's not ready to. Would rather fall asleep in his bath bucket. 13/10 would attempt a boop without waking https://t.co/MVQCzrF1g9",0,125,4355,22375,2,greater_swiss_mountain_dog,0.6227520000000001,13.0,10,0
870063196459192321,2017-05-31 23:43:25,Meet Clifford. He's quite large. Also red. Good w kids. Somehow never steps on them. Massive poops very inconvenient. Still 14/10 would ride https://t.co/apVOyDgOju,0,140,8787,37660,1,comic_book,0.534409,14.0,10,Clifford
869772420881756160,2017-05-31 04:27:59,"This is Dewey (pronounced ""covfefe""). He's having a good walk. Arguably the best walk. 13/10 would snug softly https://t.co/HciEaJkC4D",0,110,10580,43546,1,pembroke,0.980148,13.0,10,0
869702957897576449,2017-05-30 23:51:58,Meet Stanley. He likes road trips. Will shift for you. One ear more effective than other. 13/10 we don't leave until you buckle pup Stanley https://t.co/vmCu3PFCQq,0,139,6680,29014,1,pembroke,0.993449,13.0,10,Stanley
869596645499047938,2017-05-30 16:49:31,This is Scout. He just graduated. Officially a doggo now. Have fun with taxes and losing sight of your ambitions. 12/10 would throw cap for https://t.co/DsA2hwXAJo,doggo,139,3300,16431,1,chihuahua,0.955156,12.0,10,Scout
869227993411051520,2017-05-29 16:24:37,This is Gizmo. His favorite thing is standing pupright like a hooman. Sneaky tongue slip status achieved. 13/10 would boop well https://t.co/IoR3n1fiiQ,0,127,4004,21052,1,pembroke,0.664181,13.0,10,Gizmo
868880397819494401,2017-05-28 17:23:24,This is Walter. He won't start hydrotherapy without his favorite floatie. 14/10 keep it pup Walter https://t.co/r28jFx9uyF,0,98,12435,54897,1,laptop,0.153718,14.0,10,Walter
868622495443632128,2017-05-28 00:18:35,Here's a h*ckin peaceful boy. Unbothered by the comings and goings. 13/10 please reveal your wise ways https://t.co/yeaH8Ej5eM,0,102,6234,28165,1,labrador_retriever,0.868107,13.0,10,0
868552278524837888,2017-05-27 19:39:34,"Say hello to Cooper. His expression is the same wet or dry. Absolute 12/10 but Coop desperately requests your help

https://t.co/ZMTE4Mr69f https://t.co/7RyeXTYLNi",0,139,2219,10485,1,whippet,0.378151,12.0,10,Cooper
867900495410671616,2017-05-26 00:29:37,"Unbelievable. We only rate dogs. Please don't send in non-canines like the ""I"" from Pixar's opening credits. Thank you... 12/10 https://t.co/JMhDNv5wXZ",0,127,4410,24905,1,labrador_retriever,0.522644,12.0,10,0
867774946302451713,2017-05-25 16:10:44,Meet Harold.  He's h*ckin cooperative. 13/10 good work Harold https://t.co/ZYg3NZGICa,0,61,7740,35055,2,border_collie,0.661953,13.0,10,Harold
867421006826221569,2017-05-24 16:44:18,This is Shikha. She just watched you drop a skittle on the ground and still eat it. Could not be less impressed. 12/10 superior puppo https://t.co/XZlZKd73go,puppo,133,2673,16683,1,eskimo_dog,0.6164569999999999,12.0,10,Shikha
867051520902168576,2017-05-23 16:16:06,"Oh my this spooked me up. We only rate dogs, not happy ghosts. Please send dogs only. It's a very simple premise. Thank you... 13/10 https://t.co/M5Rz0R8SIQ",0,132,8367,33289,1,samoyed,0.471403,13.0,10,0
