id,timestamp,text,actual_catg,display_text_range,retweet_count,favorite_count,img_num,p1,p1_conf,rate,rate_deno,name_1
797545162159308800,2016-11-12 21:02:38,This is Cassie. She steals things. Guilt increases slightly each time. 12/10 would forgive almost immediately https://t.co/Ia19irLwyB,0,109,5622,16135,1,pembroke,0.954089,12.0,10,Cassie
797236660651966464,2016-11-12 00:36:46,This is Pancake. She loves Batman and winks like a h*ckin champ. 12/10 real crowd pleaser https://t.co/6kqsAjJNhi,0,89,7693,22250,2,collie,0.767005,12.0,10,Pancake
796865951799083009,2016-11-11 00:03:42,This is Tyr. He's just checking on you. Nifty af tongue slip. 12/10 would absolutely pet https://t.co/Jgnuiyvq06,0,88,2188,8528,1,cardigan,0.8391290000000001,12.0,10,Tyr
796759840936919040,2016-11-10 17:02:03,Say hello to Romeo. He was just told that it's too cold for the pool. H*ckin nonsense. 11/10 would help fill up https://t.co/6hx7ur6sNI,0,111,3549,13222,1,american_staffordshire_terrier,0.463996,11.0,10,Romeo
796484825502875648,2016-11-09 22:49:15,Here's a sleepy doggo that requested some assistance. 12/10 would carry everywhere https://t.co/bvkkqOjNDV,doggo,82,2035,8444,1,cocker_spaniel,0.116924,12.0,10,0
796387464403357696,2016-11-09 16:22:22,This is Snicku. He's having trouble reading because he's a dog. Glasses only helped a little. Nap preferred. 12/10 would snug well https://t.co/cVLUasbKA5,0,130,4830,12278,1,pekinese,0.461164,12.0,10,Snicku
796149749086875649,2016-11-09 00:37:46,This is Ruby. She just turned on the news. Officially terrified. 11/10 deep breaths Ruby https://t.co/y5KarNXWXt,0,88,16559,36048,1,golden_retriever,0.600276,11.0,10,Ruby
796116448414461957,2016-11-08 22:25:27,I didn't believe it at first but now I can see that voter fraud is a serious h*ckin issue. 11/10 https://t.co/7i0bDMbrVN,0,96,2796,10109,1,cardigan,0.700182,11.0,10,0
796080075804475393,2016-11-08 20:00:55,This is Yogi. He's 98% floof. Snuggable af. 12/10 https://t.co/opoXKxmfFm,0,49,2690,9426,1,chow,0.973846,12.0,10,Yogi
796031486298386433,2016-11-08 16:47:50,This is Daisy. She's here to make your day better. 13/10 mission h*ckin successful https://t.co/PbgvuD0qIL,0,82,4271,12020,1,golden_retriever,0.893775,13.0,10,Daisy
795464331001561088,2016-11-07 03:14:10,Elder doggo does a splash. Both 13/10 incredible stuff https://t.co/gBUDjdEcqz,doggo,54,27586,55479,1,golden_retriever,0.193082,13.0,10,0
795400264262053889,2016-11-06 22:59:35,This is Brody. He's trying to make the same face as the football. 12/10 https://t.co/2H4MfOGlpQ,0,71,3310,11229,2,golden_retriever,0.925494,12.0,10,Brody
795076730285391872,2016-11-06 01:33:58,This is Bailey. She loves going down slides but is very bad at it. Still 11/10 https://t.co/ivPWhspN3E,0,78,6262,18062,2,gas_pump,0.676439,11.0,10,Bailey
794926597468000259,2016-11-05 15:37:24,This is Mack. He's rather h*ckin sleepy. Exceptional ears. 12/10 would boop https://t.co/XRPvTPF0VH,0,75,2684,11454,1,teddy,0.569566,12.0,10,Mack
794332329137291264,2016-11-04 00:15:59,This is Nimbus (like the cloud). He just bought this fancy af duck raincoat. Only protects one ear tho. 12/10 so h*ckin floofy https://t.co/SIQbb8c3AU,0,126,3076,10648,1,samoyed,0.988307,12.0,10,0
794205286408003585,2016-11-03 15:51:10,This is Laika. She was a space pupper. The first space pupper actually. Orbited earth like a h*ckin boss. 14/10 hero af https://t.co/trSjgY3h4g,pupper,119,3874,10273,3,pedestal,0.66266,14.0,10,Laika
793962221541933056,2016-11-02 23:45:19,This is Maximus. His face is stuck like that. Tragic really. Great tongue tho. 12/10 would pet firmly https://t.co/xIfrsMNLBR,0,101,5679,18820,1,labrador_retriever,0.8616510000000001,12.0,10,Maximus
793845145112371200,2016-11-02 16:00:06,This is Clark. He was just caught wearing pants. 13/10 game-changing af https://t.co/2Xo19aPrG5,0,71,2177,10247,1,old_english_sheepdog,0.7652770000000001,13.0,10,Clark
793601777308463104,2016-11-01 23:53:02,This is Dobby. I can't stop looking at her feet. 12/10 would absolutely snug https://t.co/LhzPWv6rTv,0,76,1901,8881,1,miniature_pinscher,0.538981,12.0,10,Dobby
793500921481273345,2016-11-01 17:12:16,This is Fiona. She's an extremely mediocre copilot. Very distracting. Wink makes up for all the missed turns. 12/10 https://t.co/aF5MmpvPqN,0,115,2772,11908,2,golden_retriever,0.326122,12.0,10,Fiona
793286476301799424,2016-11-01 03:00:09,This is Moreton. He's the Good Boy Who Lived. 13/10 magical as h*ck https://t.co/rLHGx3VAF3,0,67,10673,27474,1,afghan_hound,0.274637,13.0,10,Moreton
793271401113350145,2016-11-01 02:00:14,Meet Dave. It's his favorite day of the year. He gets to fulfill his dream of being a dinosaur. 12/10 inspirational af https://t.co/MgQSdfZGPN,0,118,2751,9649,1,siberian_husky,0.231695,12.0,10,Dave
793256262322548741,2016-11-01 01:00:05,Oh h*ck look at this spookling right here. Fright level off the charts. 12/10 sufficiently spooked https://t.co/BNy9IIJMb0,0,98,9661,22263,1,basset,0.207622,12.0,10,0
793241302385262592,2016-11-01 00:00:38,This is Tucker. He's out here bustin h*ckin ghosts. 13/10 dedicated af https://t.co/Ap477GhwXt,0,70,3790,11741,1,golden_retriever,0.559308,13.0,10,Tucker
793226087023144960,2016-10-31 23:00:11,"This is Juno. She spooked me up real good, but only to get my attention. Above average handwriting for a dog I think. 11/10 https://t.co/hFxxBCWlwj",0,123,3322,10961,1,wire-haired_fox_terrier,0.456047,11.0,10,Juno
793210959003287553,2016-10-31 22:00:04,This is Maude. She's the h*ckin happiest wasp you've ever seen. 10/10 would pet with caution https://t.co/etL8FHBrh8,0,92,3282,9957,1,doormat,0.874431,10.0,10,Maude
793195938047070209,2016-10-31 21:00:23,Say hello to Lily. She's pupset that her costume doesn't fit as well as last year. 12/10 poor puppo https://t.co/YSi6K1firY,puppo,99,6504,17001,2,labrador_retriever,0.654762,12.0,10,Lily
793180763617361921,2016-10-31 20:00:05,This is Newt. He's a strawberry. 11/10 https://t.co/2VhmlwxA1Q,0,38,2306,7710,1,lakeland_terrier,0.266824,11.0,10,Newt
793165685325201412,2016-10-31 19:00:10,This is Benji. He's Air Bud. It's a low effort costume but he pulls it off rather h*ckin well. 12/10 would happily get dunked on https://t.co/IbzT7DJvBo,0,128,3227,10436,1,golden_retriever,0.946224,12.0,10,Benji
793150605191548928,2016-10-31 18:00:14,This is Nida. She's a free elf. Waited so long for this day. 11/10 https://t.co/3lE8Izgmkf,0,66,1982,6886,1,italian_greyhound,0.193869,11.0,10,Nida
793135492858580992,2016-10-31 17:00:11,Your favorite squad is looking extra h*ckin spooky today. 13/10 for all https://t.co/PrgvOyPtDT,0,71,2884,7182,1,bakery,0.737041,13.0,10,0
793120401413079041,2016-10-31 16:00:13,"This is Robin. She's desperately trying to do me a frighten, but her tongue drastically decreases her spook value. Still 11/10 great effort https://t.co/sxMrsOZ8zb",0,139,4533,14138,1,labrador_retriever,0.7249439999999999,11.0,10,Robin
792913359805018113,2016-10-31 02:17:31,Here is a perfect example of someone who has their priorities in order. 13/10 for both owner and Forrest https://t.co/LRyMrU7Wfq,0,104,4693,16001,4,web_site,0.226716,13.0,10,0
792883833364439040,2016-10-31 00:20:11,This is Bailey. She's rather h*ckin hype for Halloween tomorrow. Carved those pupkins herself. 12/10 https://t.co/v17mFm0Ftz,0,100,4950,12612,3,jack-o'-lantern,0.999306,12.0,10,Bailey
792773781206999040,2016-10-30 17:02:53,This is Monster. Not an actual monster tho. He's showing you his tongue. Very impressive Monster. 12/10 would snug https://t.co/RhaPExuxJL,0,114,1958,8170,1,yorkshire_terrier,0.912804,12.0,10,Monster
792394556390137856,2016-10-29 15:55:58,Meet BeBe. She rocks the messy bun of your dreams. H*ckin flawless. 12/10 would watch her tutorial https://t.co/of0pFNBIl8,0,98,4976,15071,2,cocker_spaniel,0.746387,12.0,10,BeBe
792050063153438720,2016-10-28 17:07:05,This is Remus. He's a mop that came to life. Can't see anything. Constantly trips over himself. Still a very good dog. 11/10 https://t.co/S3f1SYylzu,0,124,2080,7992,2,komondor,0.942856,11.0,10,Remus
791672322847637504,2016-10-27 16:06:04,When she says you're a good boy and you know you're a good boy because you're a good boy. 13/10 https://t.co/O5IUmRHRIh,0,95,3646,13086,1,golden_retriever,0.705092,13.0,10,0
791406955684368384,2016-10-26 22:31:36,Say hello to Levi. He's a Madagascan Butterbop. One of the more docile Butterbops I've seen. 12/10 would give all the pets https://t.co/Zcw9Sccctc,0,122,4774,14627,4,pembroke,0.972629,12.0,10,Levi
791312159183634433,2016-10-26 16:14:55,This is Mabel. She's super h*ckin smol. Portable af. Comes with the smol shoe. 12/10 would keep in frocket https://t.co/GGJvxYt3xK,0,106,2947,9801,4,miniature_pinscher,0.892925,12.0,10,Mabel
790987426131050500,2016-10-25 18:44:32,This is Misty. She has a cowboy hat on her nose. 12/10 https://t.co/Eno0mypHIr,0,54,2468,11041,1,cocker_spaniel,0.349195,12.0,10,Misty
790946055508652032,2016-10-25 16:00:09,This is Betty. She's assisting with the dishes. Such a good puppo. 12/10 h*ckin helpful af https://t.co/dgvTPZ9tgI,puppo,90,5468,18527,1,dishwasher,0.700466,12.0,10,Betty
790698755171364864,2016-10-24 23:37:28,This is Mosby. He appears to be rather h*ckin snuggable af. 12/10 keep it up Mosby https://t.co/IiiBq460I7,0,82,2191,9118,1,bernese_mountain_dog,0.996541,12.0,10,Mosby
790581949425475584,2016-10-24 15:53:19,This is Duke. He sneaks into the fridge sometimes. It's his safe place. 11/10 would give little jacket if necessary https://t.co/Fd5WFDTMH4,0,115,8143,22397,2,refrigerator,0.998886,11.0,10,Duke
790337589677002753,2016-10-23 23:42:19,Meet Maggie. She can hear your cells divide. 12/10 can also probably fly https://t.co/ovE2hqXryV,0,72,2160,8696,1,pembroke,0.658808,12.0,10,Maggie
790277117346975746,2016-10-23 19:42:02,This is Bruce. He never backs down from a challenge. 11/10 you got this Bruce https://t.co/aI7umZHIq7,0,77,3717,14015,1,labrador_retriever,0.427742,11.0,10,Bruce
789986466051088384,2016-10-23 00:27:05,This is Happy. He's a bathtub reviewer. Seems to be pleased with this one. 12/10 https://t.co/Ln89R4FP7v,0,80,2686,10311,1,tub,0.479477,12.0,10,Happy
789628658055020548,2016-10-22 00:45:17,This is Eli. He can fly. 13/10 magical af https://t.co/huPSJJ7FDI,0,41,2072,8410,1,chow,0.260702,13.0,10,Eli
789599242079838210,2016-10-21 22:48:24,This is Brownie. She's wearing a Halloween themed onesie. 12/10 festive af https://t.co/0R4meWXFOx,0,74,2267,7579,2,chesapeake_bay_retriever,0.8788219999999999,12.0,10,Brownie
789530877013393408,2016-10-21 18:16:44,This is Rizzy. She smiles a lot. 12/10 contagious af https://t.co/TU4sZogVIq,0,52,3924,13117,3,schipperke,0.363272,12.0,10,Rizzy
789268448748703744,2016-10-21 00:53:56,This is Stella. She's happier than I will ever be. 10/10 would trade lives with https://t.co/JSs2bfDtTS,0,79,2996,10147,1,malamute,0.81286,10.0,10,Stella
789137962068021249,2016-10-20 16:15:26,This is Bo. He's a West Congolese Bugaboop Snuggle. Rather exotic. Master of the head tilt. 12/10 would pay to pet https://t.co/2jwxxtNzoN,0,114,3232,10824,2,chihuahua,0.746135,12.0,10,Bo
788908386943430656,2016-10-20 01:03:11,"This is Lucy. She destroyed not one, but two remotes trying to turn off the debate. 11/10 relatable af https://t.co/3BXh073tDm",0,102,14347,30520,1,remote_control,0.8815379999999999,11.0,10,Lucy
788765914992902144,2016-10-19 15:37:03,This is Butter. She can have whatever she wants forever. 12/10 would hug softly https://t.co/x5gXRS1abq,0,79,11969,30604,1,cocker_spaniel,0.500509,12.0,10,Butter
788412144018661376,2016-10-18 16:11:17,This is Dexter. He breaks hearts for a living. 11/10 h*ckin handsome af https://t.co/4DhSsC1W7S,0,71,5964,15998,1,golden_retriever,0.805238,11.0,10,Dexter
788178268662984705,2016-10-18 00:41:57,Atlas is back and this time he's got doggles. Still 13/10 solarly conscious af https://t.co/s7MgFWDySc,0,78,2477,8060,2,samoyed,0.73548,13.0,10,0
788150585577050112,2016-10-17 22:51:57,This is Leo. He's a golden chow. Rather h*ckin rare. 13/10 would give extra pats https://t.co/xosHjFzVXc,0,80,1502,6837,3,chow,0.814145,13.0,10,Leo
788039637453406209,2016-10-17 15:31:05,Did... did they pick out that license plate? 12/10 for both https://t.co/lRmUUOxgbQ,0,59,1529,6838,1,beach_wagon,0.362925,12.0,10,0
787810552592695296,2016-10-17 00:20:47,This is Frank. He wears sunglasses and walks himself. 11/10 I'll never be this cool or independent https://t.co/pNNjBtHWPc,0,98,3523,9678,2,pug,0.362835,11.0,10,Frank
787717603741622272,2016-10-16 18:11:26,This is Tonks. She is a service puppo. Can hear a caterpillar hiccup from 7 miles away. 13/10 would follow anywhere https://t.co/i622ZbWkUp,puppo,115,3226,11370,3,german_shepherd,0.992339,13.0,10,Tonks
787397959788929025,2016-10-15 21:01:17,This is Moose. He's rather h*ckin dangerous (you can tell by the collar). 11/10 would still attempt to snug https://t.co/lHVHGdDzb3,0,107,3281,12064,1,chihuahua,0.900483,11.0,10,Moose
787322443945877504,2016-10-15 16:01:13,This is Lincoln. He forgot to use his blinker when he changed lanes just now. Guilty as h*ck. Still 10/10 https://t.co/lsrR83SiVp,0,105,2024,8687,1,seat_belt,0.747739,10.0,10,Lincoln
786963064373534720,2016-10-14 16:13:10,This is Rory. He's got an interview in a few minutes. Looking spiffy af. Nervous as h*ck tho. 12/10 would hire https://t.co/ibj5g6xaAj,0,110,9272,29595,1,golden_retriever,0.915303,12.0,10,Rory
786709082849828864,2016-10-13 23:23:56,"This is Logan, the Chow who lived. He solemnly swears he's up to lots of good. H*ckin magical af 9.75/10 https://t.co/yBO5wuqaPS",0,104,7033,20221,1,pomeranian,0.467321,9.75,10,0
786664955043049472,2016-10-13 20:28:35,"""Honestly Kathleen I just want more Ken Bone"" 12/10 https://t.co/HmlEvAMP4r",0,51,2981,11908,1,leonberg,0.512034,12.0,10,0
786595970293370880,2016-10-13 15:54:28,This is Dale. He's a real spookster. Did me quite the frighten. 11/10 not too spooky to pet tho https://t.co/L8BWDD4oBX,0,95,3575,10460,1,pembroke,0.709512,11.0,10,Dale
786363235746385920,2016-10-13 00:29:39,This is Rizzo. He has many talents. A true renaissance doggo. 13/10 entertaining af https://t.co/TVXpEJB7Wn,doggo,83,4054,12129,1,golden_retriever,0.929266,13.0,10,Rizzo
786233965241827333,2016-10-12 15:55:59,This is Mattie. She's extremely dangerous. Will bite your h*ckin finger right off. Still 11/10 would pet with caution https://t.co/78c9W8kLFh,0,117,5529,17100,1,labrador_retriever,0.478193,11.0,10,Mattie
785927819176054784,2016-10-11 19:39:28,This is Lucy. She's strives to be the best potato she can be. 12/10 would boop https://t.co/lntsj7Fc4Y,0,78,3627,12636,1,teddy,0.97207,12.0,10,Lucy
785872687017132033,2016-10-11 16:00:24,Meet Rusty. He appears to be rather h*ckin fluffy. Also downright adorable af. 12/10 would rub my face against his https://t.co/1j9kLGb4wV,0,114,2112,7452,1,great_pyrenees,0.392108,12.0,10,Rusty
785639753186217984,2016-10-11 00:34:48,This is Pinot. He's a sophisticated doggo. You can tell by the hat. Also pointier than your average pupper. Still 10/10 would pet cautiously https://t.co/f2wmLZTPHd,doggo,140,2545,8680,1,porcupine,0.978042,10.0,10,Pinot
785533386513321988,2016-10-10 17:32:08,This is Dallas. Her tongue is ridiculous. 11/10 h*ckin proud af https://t.co/h4jhlH4EyG,0,63,2318,10146,2,miniature_pinscher,0.436023,11.0,10,Dallas
785264754247995392,2016-10-09 23:44:41,This is Doc. He requested to be carried around like that. 12/10 anything for Doc https://t.co/mWYACm4qnx,0,80,1897,8095,1,teddy,0.6748930000000001,12.0,10,Doc
785170936622350336,2016-10-09 17:31:53,This is Hero. He was enjoying the car ride until he remembered that bees are dying globally at an alarming rate. 11/10 https://t.co/cubFg7F4qQ,0,118,5608,13438,2,seat_belt,0.891193,11.0,10,Hero
784826020293709826,2016-10-08 18:41:19,This is Rusty. He's going D1 for sure. Insane vertical. 13/10 would draft https://t.co/AsykOwMrXQ,0,73,3698,11268,1,chow,0.0903414,13.0,10,Rusty
784517518371221505,2016-10-07 22:15:26,This is Frankie. He has yet to learn how to control his tongue. 11/10 maybe one day https://t.co/p6fgYe2dB6,0,83,2945,10005,2,malamute,0.757764,11.0,10,Frankie
784431430411685888,2016-10-07 16:33:21,This is Stormy. He's curly af. Already pupared for Coachella next year. 12/10 https://t.co/PHA1vtqqpt,0,77,1479,6308,1,miniature_poodle,0.744819,12.0,10,Stormy
783839966405230592,2016-10-06 01:23:05,This is Riley. His owner put a donut pillow around him and he loves it so much he won't let anyone take it off. 13/10 https://t.co/8TCQcsZCZ8,0,117,12544,33544,1,quilt,0.333739,13.0,10,Riley
783821107061198850,2016-10-06 00:08:09,This is Mairi. She has mastered the art of camouflage. 12/10 h*ckin sneaky af https://t.co/STcPjiNAHp,0,77,2259,8176,1,lakeland_terrier,0.26565900000000003,12.0,10,Mairi
783695101801398276,2016-10-05 15:47:27,This is Loomis. He's the leader of the Kenneth search party. The passion is almost overwhelming. 12/10 one day he will be free https://t.co/kCRKlFg4AY,0,126,3706,11595,3,chow,0.314265,12.0,10,Loomis
783466772167098368,2016-10-05 00:40:09,This is Finn. He likes eavesdropping from filing cabinets. It's a real issue but no one has approached him about it. 11/10 would still pet https://t.co/s8W8Del9HQ,0,138,2586,9426,1,chihuahua,0.789,11.0,10,Finn
783391753726550016,2016-10-04 19:42:03,Meet Godi. He's an avid beachgoer and part time rainbow summoner. Eyeliner flawless af. 13/10 would snug well https://t.co/BO936YdJdi,0,109,6393,18821,4,norwegian_elkhound,0.87713,13.0,10,Godi
783334639985389568,2016-10-04 15:55:06,This is Dave. He's currently in a predicament. Doesn't seem to mind tho. 12/10 someone assist Dave https://t.co/nfprKAXqwu,0,98,13512,32504,2,cardigan,0.593858,12.0,10,Dave
783085703974514689,2016-10-03 23:25:55,This is Earl. He can't catch. Did his best tho. 11/10 would repair confidence with extra pats https://t.co/IsqyvbjFgM,0,93,2541,9069,1,chesapeake_bay_retriever,0.240602,11.0,10,Earl
782969140009107456,2016-10-03 15:42:44,This is Cali. She arrived preassembled. Convenient af. 12/10 appears to be rather h*ckin pettable https://t.co/vOBV1ZqVcX,0,97,8471,26849,1,seat_belt,0.474292,12.0,10,Cali
782747134529531904,2016-10-03 01:00:34,This is Deacon. He's the happiest almost dry doggo I've ever seen. 11/10 would smile back https://t.co/C6fUMnHt1H,doggo,89,1593,8276,1,golden_retriever,0.560699,11.0,10,Deacon
782722598790725632,2016-10-02 23:23:04,"This is Penny. She fought a bee and the bee won. 10/10 you're fine Penny, everything's fine https://t.co/zrMVdfFej6",0,91,6201,19173,1,irish_setter,0.574557,10.0,10,Penny
782598640137187329,2016-10-02 15:10:30,This is Timmy. He's quite large. According to a trusted source it's actually a dog wearing a dog suit. 11/10 https://t.co/BIUchFwHqn,0,108,2177,8664,1,malamute,0.8408709999999999,11.0,10,Timmy
782305867769217024,2016-10-01 19:47:08,This is Sampson. He just graduated. Ready to be a doggo now. Time for the real world. 12/10 have fun with taxes https://t.co/pgVKxRw0s1,doggo,111,6424,18547,1,briard,0.5044270000000001,12.0,10,Sampson
781955203444699136,2016-09-30 20:33:43,This is Chipson. He weighed in at .3 ounces and is officially super h*ckin smol. Space-saving af. 11/10 would snug delicately https://t.co/FjEsk7A1JV,0,125,3885,12317,1,pool_table,0.179568,11.0,10,Chipson
781661882474196992,2016-09-30 01:08:10,Who keeps sending in pictures without dogs in them? This needs to stop. 5/10 for the mediocre road https://t.co/ELqelxWMrC,0,98,3107,11586,1,pembroke,0.438087,5.0,10,0
781524693396357120,2016-09-29 16:03:01,Idk why this keeps happening. We only rate dogs. Not Bangladeshi Couch Chipmunks. Please only send dogs... 12/10 https://t.co/ya7bviQUUf,0,112,6383,23074,1,tennis_ball,0.994712,12.0,10,0
781251288990355457,2016-09-28 21:56:36,This is Oakley. He just got yelled at for going 46 in a 45. Churlish af. 11/10 would still pet so well https://t.co/xIYsa6LPA4,0,102,2430,9403,2,mexican_hairless,0.8877709999999999,11.0,10,Oakley
781163403222056960,2016-09-28 16:07:23,"We normally don't rate lobsters, but this one appears to be a really good lobster. 10/10 would pet with caution https://t.co/YkHc7U7uUy",0,111,3149,10852,1,shetland_sheepdog,0.973841,10.0,10,0
780931614150983680,2016-09-28 00:46:20,I want to finally rate this iconic puppo who thinks the parade is all for him. 13/10 would absolutely attend https://t.co/5dUYOu4b8d,puppo,108,8471,24088,1,padlock,0.731564,13.0,10,0
780858289093574656,2016-09-27 19:54:58,"This is Dash. He's very stylish, but also incredibly unimpressed with the current state of our nation. 10/10 would pet ears first https://t.co/YElO4hvXI6",0,129,2311,8007,1,chesapeake_bay_retriever,0.488555,10.0,10,Dash
780800785462489090,2016-09-27 16:06:28,This is Koda. He has a weird relationship with tall grass. Slightly concerning. 11/10 would def still pet https://t.co/KQzSR8eCsw,0,105,1493,6114,2,siberian_husky,0.951963,11.0,10,Koda
780601303617732608,2016-09-27 02:53:48,Meet Hercules. He can have whatever he wants for the rest of eternity. 12/10 would snug passionately https://t.co/mH0IOyFdIG,0,100,3810,13464,1,saint_bernard,0.995143,12.0,10,Hercules
780543529827336192,2016-09-26 23:04:13,Here's a perturbed super floof. 12/10 would snug so damn well https://t.co/VG095mi09Q,0,61,2008,7001,1,golden_retriever,0.628312,12.0,10,0
780459368902959104,2016-09-26 17:29:48,"This is Bear. Don't worry, he's not a real bear tho. Contains unreal amounts of squish. 11/10 heteroskedastic af https://t.co/coi4l1T2Sm",0,112,1221,5868,1,great_dane,0.382491,11.0,10,Bear
780192070812196864,2016-09-25 23:47:39,We only rate dogs. Pls stop sending in non-canines like this Urban Floof Giraffe. I can't handle this. 11/10 https://t.co/zHIqpM5Gni,0,108,2571,9671,1,vizsla,0.144012,11.0,10,0
779834332596887552,2016-09-25 00:06:08,This is Scout. He really wants to kiss himself. H*ckin inappropriate. 11/10 narcissistic af https://t.co/x0gV2Ck3AD,0,91,8148,21161,1,golden_retriever,0.99383,11.0,10,Scout
779377524342161408,2016-09-23 17:50:56,Have you ever seen such a smol pupper? Portable af. 12/10 would keep in shirt pocket https://t.co/KsqaIzlQ12,pupper,84,3584,9791,1,sundial,0.17092100000000002,12.0,10,0
779123168116150273,2016-09-23 01:00:13,This is Reggie. He hugs everyone he meets. 12/10 keep spreading the love Reggie https://t.co/uMfhduaate,0,79,4189,13146,1,toy_poodle,0.43108,12.0,10,Reggie
779056095788752897,2016-09-22 20:33:42,Everybody drop what you're doing and look at this dog. 13/10 must be super h*ckin rare https://t.co/I1bJUzUEW5,0,86,5202,16444,1,chihuahua,0.721188,13.0,10,0
778990705243029504,2016-09-22 16:13:51,This is Jay. He's really h*ckin happy about the start of fall. Sneaky tongue slip in 2nd pic. 11/10 snuggly af https://t.co/vyx1X5eyWI,0,110,8371,22262,2,cocker_spaniel,0.7153510000000001,11.0,10,Jay
778748913645780993,2016-09-22 00:13:04,"This is Mya (pronounced ""mmmyah?""). Her head is round af. 11/10 would pat accordingly https://t.co/1dpEuALnY0",0,85,1549,7681,1,staffordshire_bullterrier,0.351434,11.0,10,0
778650543019483137,2016-09-21 17:42:10,"Meet Strider. He thinks he's a sorority girl. Already wants to go to NYC for a weekend to say he's ""studied abroad"" 10/10 https://t.co/KYZkPuiC1l",0,121,1714,6415,1,german_shepherd,0.515699,10.0,10,Strider
778624900596654080,2016-09-21 16:00:17,This is Penny. She's a sailor pup. 11/10 would take to the open seas with https://t.co/0rRxyBQt32,0,73,1165,5166,2,airedale,0.786089,11.0,10,Penny
778408200802557953,2016-09-21 01:39:11,RIP Loki. Thank you for the good times. You will be missed by many. 14/10 https://t.co/gJKD9pst5A,0,73,4988,15089,3,pembroke,0.8483620000000001,14.0,10,0
778383385161035776,2016-09-21 00:00:35,This is Nala. She's a future Dogue model. Won't respond to my texts. 13/10 would be an honor to pet https://t.co/zP1IvAATWv,0,99,1264,6502,1,collie,0.345266,13.0,10,Nala
778286810187399168,2016-09-20 17:36:50,This is Stanley. He has too much skin. Isn't happy about it. Quite pupset actually. Still 11/10 would comfort https://t.co/hhTfnPrWfb,0,109,3804,11529,1,boston_bull,0.32207,11.0,10,Stanley
778039087836069888,2016-09-20 01:12:28,Evolution of a pupper yawn featuring Max. 12/10 groundbreaking stuff https://t.co/t8Y4x9DmVD,pupper,68,3040,9386,2,german_shepherd,0.717776,12.0,10,0
778027034220126208,2016-09-20 00:24:34,This is Sophie. She's a Jubilant Bush Pupper. Super h*ckin rare. Appears at random just to smile at the locals. 11.27/10 would smile back https://t.co/QFaUiIHxHq,pupper,137,1867,7292,1,clumber,0.946718,11.27,10,Sophie
777885040357281792,2016-09-19 15:00:20,This is Wesley. He's clearly trespassing. Seems rather h*ckin violent too. Weaponized forehead. 3/10 wouldn't let in https://t.co/pL7wbMRW7M,0,116,1882,7054,1,afghan_hound,0.123529,3.0,10,Wesley
777684233540206592,2016-09-19 01:42:24,"""Yep... just as I suspected. You're not flossing."" 12/10 and 11/10 for the pup not flossing https://t.co/SuXcI9B7pQ",0,91,3390,12468,1,cocker_spaniel,0.253442,12.0,10,0
777621514455814149,2016-09-18 21:33:11,This is Derek. You can't look at him and not smile. Must've just had a blue pupsicle. 12/10 would snug intensely https://t.co/BnVTMtUeI3,0,112,2884,9706,1,chow,0.999823,12.0,10,Derek
777189768882946048,2016-09-17 16:57:35,This is Jeffrey. He's being held so he doesn't fly away. 12/10 would set free https://t.co/d3aLyCykn7,0,77,4965,15858,2,chihuahua,0.988412,12.0,10,Jeffrey
776813020089548800,2016-09-16 16:00:31,Meet Solomon. He was arrested for possession of adorable and attempted extra pats on the head. 12/10 would post bail https://t.co/nFqLaOLUQA,0,116,1393,5420,1,toy_poodle,0.51661,12.0,10,Solomon
776477788987613185,2016-09-15 17:48:25,This is Huck. He's addicted to caffeine. Hope it's not too latte to seek help. 11/10 stay strong pupper https://t.co/iJE3F0VozW,pupper,103,3223,9823,1,labrador_retriever,0.8848389999999999,11.0,10,Huck
